show_id,type,title,director,cast,country,date_added,release_year,rating,duration,listed_in
s7464,Movie,Wakefield,Robin Swicord,"Bryan Cranston, Jennifer Garner, Jason O'Mara, Beverly D'Angelo, Ian Anthony Dale, Pippa Bennett-Warner, Isaac Leyva, Victoria Bruno, Ellery Sprayberry, Tracey Walter",United States,2-Mar-19,2016,R,109 min,Dramas
s6071,Movie,The Aerial,Esteban Sapir,"Rafael Ferro, Sol Moreno, Jonathan Sandor, Alejandro Urdapilleta, Julieta Cardinali, Florencia Raggi, Valeria Bertuccelli, Raúl Hochman, Ricardo Merkin, Carlos Piñeyro",Argentina,1-Apr-18,2007,TV-MA,99 min,"Dramas, International Movies, Sci-Fi & Fantasy"
s7136,Movie,Tom Papa Live in New York City,Rob Zombie,Tom Papa,United States,31-Dec-18,2011,TV-14,57 min,Stand-Up Comedy
s5768,Movie,Spookley the Square Pumpkin,Bernie Denk,"Sonja Ball, Craig Francis, Rick Jones, Michel Perron, Holly Gauthier-Frankel, Norman Groulx, Terrence Scammell, Bruce Dinsmore, Jennifer Seguin",United States,1-Sep-19,2004,G,47 min,Children & Family Movies
s1375,Movie,Chronically Metropolitan,Xavier Manrique,"Shiloh Fernandez, Ashley Benson, Josh Peck, Addison Timlin, Chris Noth, Mary-Louise Parker",United States,1-Feb-20,2016,TV-MA,86 min,"Comedies, Dramas, Independent Movies"
s105,Movie,30 Minutes or Less,Ruben Fleischer,"Jesse Eisenberg, Danny McBride, Aziz Ansari, Nick Swardson, Dilshad Vadsaria, Michael Peña, Bianca Kajlich, Fred Ward",United States,1-Jan-21,2011,R,83 min,"Action & Adventure, Comedies"
s5208,Movie,Righteous Kill,Jon Avnet,"Robert De Niro, Al Pacino, 50 Cent, Carla Gugino, John Leguizamo, Donnie Wahlberg, Brian Dennehy, Trilby Glover",United States,1-Jun-19,2008,R,101 min,"Dramas, Thrillers"
s5723,Movie,Soorma,Shaad Ali,"Diljit Dosanjh, Tapsee Pannu, Angad Bedi, Kulbhushan Kharbanda, Satish Kaushik, Vijay Raaz, Seema Kaushal, Mahabir Bhullar, Alka Badola Kaushal, Jimmy Moses",India,13-Oct-18,2018,TV-14,131 min,"Dramas, International Movies, Sports Movies"
s1230,Movie,Casa de mi Padre,Matt Piedmont,"Will Ferrell, Gael García Bernal, Diego Luna, Genesis Rodriguez, Pedro Armendáriz Jr., Nick Offerman, Efren Ramirez, Adrian Martinez","United States, Mexico",14-Nov-12,2012,R,84 min,Comedies
s4237,Movie,MOTHER,Tatsushi Omori,"Masami Nagasawa, Sadao Abe, Daiken Okudaira",Japan,3-Nov-20,2020,TV-14,127 min,"Dramas, International Movies"
s6073,Movie,The After Party,Ian Edelman,"Kyle Harvey, Harrison Holzer, Teyana Taylor, Shelley Hennig, Wiz Khalifa, Blair Underwood, Jordan Rock, Amin Joseph, Andy Buckley, Jamie Choi",United States,24-Aug-18,2018,TV-MA,90 min,"Comedies, Music & Musicals"
s2875,Movie,Hurricane Bianca,Matt Kugelman,"Roy Haylock, Bianca Leigh, Denton Blane Everett, Willam Belli, D.J. ""Shangela"" Pierce, Justin ""Alyssa Edwards"" Johnson, Molly Ryman, Ted Ferguson, Rachel Dratch, Alan Cumming, Margaret Cho, RuPaul",United States,1-Jan-17,2016,TV-MA,85 min,"Comedies, Independent Movies, LGBTQ Movies"
s5675,Movie,Small Town Crime,"Ian Nelms, Eshom Nelms","John Hawkes, Anthony Anderson, Octavia Spencer, Robert Forster, Clifton Collins Jr., Jeremy Ratchford, James Lafferty, Michael Vartan, Daniel Sunjata, Don Harvey, Stefanie Scott, Caity Lotz, Dale Dickey",United States,19-May-18,2017,R,92 min,Thrillers
s7770,Movie,Zindagi Na Milegi Dobara,Zoya Akhtar,"Hrithik Roshan, Abhay Deol, Farhan Akhtar, Katrina Kaif, Kalki Koechlin, Deepti Naval, Naseeruddin Shah, Ariadna Cabrol",India,15-Dec-19,2011,TV-14,154 min,"Comedies, Dramas, International Movies"
s5169,Movie,Residue,Merawi Gerima,"Obinna Nwachukwu, Dennis Lindsey, Taline Stewart, Derron Scott, Jamal Graham, JaCari Dye, Julian Selman, Melody Tally, Ramon Thompson, Hasinatu Camara",United States,17-Sep-20,2020,TV-MA,90 min,"Dramas, Independent Movies"
s4749,Movie,Palm Trees in the Snow,Fernando González Molina,"Mario Casas, Adriana Ugarte, Macarena García, Alain Hernández, Laia Costa, Emilio Gutiérrez Caba, Berta Vázquez, Daniel Grao",Spain,1-May-16,2015,TV-MA,163 min,"Dramas, International Movies, Romantic Movies"
s493,Movie,An Hour and a Half,Wael Ehsan,"Eyad Nassar, Ahmed Bedir, Fathy Abdel Wahab, Sawsan Badr, Maged El Kedwany, Tarek Abdel Aziz, Karima Mokhtar, Yousra El Lozy, Somaya El Khashab, Mohamed Emam",Egypt,26-Apr-19,2012,TV-14,87 min,"Dramas, International Movies"
s5415,Movie,Saverio Raimondo: Il Satiro Parlante,Francesco Imperato,Saverio Raimondo,Italy,17-May-19,2019,TV-MA,53 min,Stand-Up Comedy
s2872,Movie,Hunterrr,Harshavardhan Kulkarni,"Gulshan Devaiah, Radhika Apte, Sai Tamhankar, Veera Saxena, Sagar Deshmukh",India,12-Oct-20,2015,TV-MA,140 min,"Comedies, International Movies, Romantic Movies"
s5932,Movie,Svaha: The Sixth Finger,Jang Jae-hyun,"Lee Jung-jae, Park Jung-min, Lee Jae-in, Yoo Ji-tae, Jung Jin-young, Lee Da-wit, Jin Seon-kyu, Ji Seung-hyeon, Min Tanaka",South Korea,30-May-19,2019,TV-MA,123 min,"International Movies, Thrillers"
s2644,Movie,Haseena Maan Jaayegi,David Dhawan,"Sanjay Dutt, Govinda, Karisma Kapoor, Pooja Batra, Kader Khan, Paresh Rawal, Satish Kaushik, Aruna Irani, Anupam Kher, Ashish Vidyarthi, Aashif Sheikh, Asrani, Razak Khan, Shakti Kapoor, Bindu, Mahavir Shah, Mohan Joshi, Anil Dhawan",India,1-Mar-18,1999,TV-PG,151 min,"Action & Adventure, Comedies, Dramas"
s6360,TV Show,The Flash,Glen Winter,"Grant Gustin, Candice Patton, Danielle Panabaker, Carlos Valdes, Tom Cavanagh, Jesse L. Martin, Neil Sandilands, Britne Oldford, Danielle Nicolet, Keiynan Lonsdale, Kim Engelbrecht",United States,20-May-20,2019,TV-14,6 Seasons,"Crime TV Shows, TV Action & Adventure, TV Sci-Fi & Fantasy"
s1687,Movie,Defying the Nazis: The Sharps' War,"Ken Burns, Artemis Joukowsky","Tom Hanks, Marina Goldman",United States,1-May-17,2016,TV-14,79 min,Documentaries
s2917,Movie,"I love you, stupid",Laura Mañá,"Quim Gutiérrez, Natalia Tena, Alfonso Bassave, Alba Ribas, Patricia Vico, Ernesto Alterio",Spain,15-May-20,2019,TV-MA,88 min,"Comedies, International Movies, Romantic Movies"
s4033,Movie,Men in Black II,Barry Sonnenfeld,"Tommy Lee Jones, Will Smith, Rip Torn, Lara Flynn Boyle, Johnny Knoxville, Rosario Dawson, Tony Shalhoub, Patrick Warburton, Jack Kehler, David Cross",United States,1-Oct-19,2002,PG-13,88 min,"Action & Adventure, Comedies, Sci-Fi & Fantasy"
s3940,Movie,Maria Bamford: The Special Special Special,Jordan Brady,"Maria Bamford, Wayne Federman, Jackie Kashian",United States,25-Aug-18,2012,TV-MA,50 min,Stand-Up Comedy
s4017,Movie,Meet the In-Laws,Niyi Akinmolayan,"Adeniyi Johnson, Tina Mba, Dele Odule, Lilian Esoro, Amaechi Muonagor, Blessing Onwukwe, Dayo Amusa, Kenneth Okolie",Nigeria,18-Aug-20,2017,TV-PG,75 min,"Comedies, Dramas, International Movies"
s5961,Movie,Take Me Home Tonight,Michael Dowse,"Topher Grace, Anna Faris, Dan Fogler, Teresa Palmer, Chris Pratt, Michael Biehn, Jeanie Hackett, Lucy Punch, Michelle Trachtenberg, Demetri Martin","United States, Germany",16-May-19,2011,R,97 min,"Comedies, Romantic Movies"
s2781,Movie,Holy Goalie,Curro Velázquez,"Karra Elejalde, Alain Hernández, Juan Manuel Montilla, Joel Bosqued, Macarena García, Tito Valverde, Paco Rueda, Guillermo Furiase, Txema Blasco, Paco Sagarzazu",Spain,27-Apr-18,2017,TV-MA,95 min,"Comedies, International Movies, Sports Movies"
s4835,Movie,Pete Davidson: Alive From New York,Jason Orley,Pete Davidson,United States,25-Feb-20,2020,TV-MA,50 min,Stand-Up Comedy
s1725,Movie,Dev.D,Anurag Kashyap,"Abhay Deol, Mahie Gill, Kalki Koechlin, Sindbad Phgura, Ammo 'Too Sweet', Jimi the Quiff, Parakh Madan",India,1-Oct-18,2009,TV-MA,137 min,"Dramas, International Movies, Romantic Movies"
s6849,Movie,The Sapphires,Wayne Blair,"Chris O'Dowd, Deborah Mailman, Jessica Mauboy, Shari Sebbens, Miranda Tapsell, Tory Kittles, Eka Darville, Tammy Anderson, Lynette Narkle, Kylie Belling",Australia,26-Apr-19,2012,PG-13,99 min,"Comedies, Dramas, Independent Movies"
s114,Movie,48 Christmas Wishes,"Marco Deufemia, Justin G. Dyck","Khiyla Aynne, Noah Dyer, Maya Franzoi, Clara Kushnir, Madeline Leon, Liam MacDonald, Matt Schichter, Ethan Yang, Adam Crew",Canada,20-Dec-17,2017,TV-G,84 min,"Children & Family Movies, Comedies"
s3541,Movie,Last Flight to Abuja,Obi Emelonye,"Omotola Jalade-Ekeinde, Hakeem Kae-Kazim, Jim Iyke, Ali Nuhu, Jide Kosoko, Anthony Monjaro, Jennifer Oguzie, Uru Eke, Celine Loader","Nigeria, United Kingdom",16-Jun-20,2012,TV-14,76 min,"Dramas, International Movies"
s294,Movie,Accident,Cheang Pou Soi,"Louis Koo, Richie Ren, Stanley Fung Sui-Fan, Michelle Ye, Lam Suet, Alexander Chan, Monica Mok",Hong Kong,1-Dec-18,2009,TV-MA,87 min,"International Movies, Thrillers"
s5446,Movie,SDU: Sex Duties Unit,Gary Mak,"Chapman To, Shawn Yue, Matt Chow, Kwok Cheung Tsang",Hong Kong,1-Dec-18,2013,TV-MA,96 min,"Comedies, International Movies"
s6405,Movie,The Good Neighbor,Kasra Farahani,"James Caan, Logan Miller, Keir Gilchrist, Laura Innes, Edwin Hodge, Anne Dudek, Bailey Noble, Lili Reinhart, Mindy Sterling",United States,5-Dec-16,2016,TV-MA,97 min,"Dramas, Independent Movies, Thrillers"
s3791,Movie,Lovesong,So Yong Kim,"Jena Malone, Riley Keough, Brooklyn Decker, Amy Seimetz, Ryan Eggold, Rosanna Arquette, Cary Joji Fukunaga, Marshall Chapman, Neal Huff",United States,15-May-17,2016,TV-MA,84 min,"Dramas, Independent Movies, Romantic Movies"
s1776,Movie,Disciples Of The 36th Chamber,Chia-Liang Liu,"Hou Hsiao, Gordon Liu, Lily Li, Jason Pai Piao, Chia-Liang Liu",Hong Kong,16-Aug-18,1985,TV-14,90 min,"Action & Adventure, International Movies"
s2012,Movie,Entanglement,Jason James,"Thomas Middleditch, Jess Weixler, Diana Bang, Randal Edwards, Marilyn Norry, Johannah Newmarch, Nicole LaPlaca",Canada,9-Dec-18,2018,TV-MA,85 min,"Dramas, Independent Movies, Romantic Movies"
s6758,Movie,The Pink Panther,Shawn Levy,"Steve Martin, Kevin Kline, Beyoncé Knowles-Carter, Jean Reno, Emily Mortimer, Henry Czerny, Kristin Chenoweth, Roger Rees, Philip Goodwin, Henri Garcin, William Abadie","United States, Czech Republic",1-Jul-19,2006,PG,93 min,"Children & Family Movies, Comedies"
s7200,Movie,Travel Mates 2,Bedran Güzel,"Oğuzhan Koç, İbrahim Büyükak, Ezgi Eyüboğlu, Olgun Toker, Kadir Polatçi, Aycan Koptur, Bahar Şahin, Kıvanç Baran Arslan",Turkey,20-Sep-19,2018,TV-MA,111 min,"Comedies, International Movies"
s6434,Movie,The Hard Way,Keoni Waxman,"Michael Jai White, Luke Goss, Randy Couture, Madalina Anea, Grant Campbell, George Remes, Ovidiu Niculescu, Adreea Diac, Michaela Holla, Bogden Farcas",United States,5-Mar-19,2019,TV-MA,94 min,Action & Adventure
s3921,Movie,Mantra,Nicholas Kharkongor,"Rajat Kapoor, Lushin Dubey, Kalki Koechlin, Shiv Pandit, Adil Hussain, Rohan Joshi, Yuri Suri, Maya Krishna Rao",India,15-Dec-17,2017,TV-14,89 min,"Dramas, Independent Movies, International Movies"
s919,Movie,Bill Burr: You People Are All the Same,Jay Karas,Bill Burr,United States,30-Jun-18,2012,TV-MA,69 min,Stand-Up Comedy
s6705,Movie,The New Romantic,Carly Stone,"Timm Sharp, Hayley Law, Camila Mendes, Brett Dier, Jessica Barden, Avan Jogia",Canada,15-Apr-19,2018,TV-MA,82 min,"Comedies, Independent Movies, Romantic Movies"
s1658,Movie,Deadly Switch,Svetlana Cvetko,"Teri Polo, Dylan Walsh, Danika Yarosh, Hayley McLaughlin, Bryce Durfee, Matt Passmore, Heather Mazur, Ashlyn Pearce",United States,15-Jan-19,2019,TV-PG,86 min,"Independent Movies, Thrillers"
s4064,Movie,Mi Shivajiraje Bhosale Boltoy,Santosh Manjrekar,"Sachin Khedekar, Mahesh Manjrekar, Makarand Anaspure, Suchitra Bandekar, Siddharth Jadhav, Priya Bapat, Abhijit Kelkar, Ganesh Yadav, Reema Lagoo, Vidyadhar Joshi",India,1-Jan-18,2009,TV-14,148 min,"Comedies, International Movies, Sci-Fi & Fantasy"
s2866,Movie,Hungerford,Drew Casson,"Drew Casson, Georgia Bradley, Sam Carter, Tom Scarlett, Nigel Morgan, Colin Stark, Kitty Speed",United Kingdom,23-Jun-18,2014,TV-MA,79 min,"Horror Movies, Independent Movies, International Movies"
s879,Movie,Beyond the Clouds,Majid Majidi,"Ishaan Khattar, Malavika Mohanan, Goutam Ghose, Sharada, Tannishtha Chatterjee, Shashank Shende, Hema Singh, Akash Gopal","India, Iran",10-Aug-18,2018,TV-14,120 min,"Dramas, Independent Movies, International Movies"
s225,Movie,A Separation,Asghar Farhadi,"Leila Hatami, Peyman Moaadi, Shahab Hosseini, Sareh Bayat, Sarina Farhadi, Babak Karimi, Ali-Asghar Shahbazi, Shirin Yazdanbakhsh, Kimia Hosseini, Merila Zare'i, Sahabanu Zolghadr","Iran, France",16-Mar-19,2011,PG-13,123 min,"Dramas, International Movies"
s5984,Movie,Taramani,Ram,"Andrea Jeremiah, Anjali, Vasanth Ravi, Adrian Knight Jesly, Azhagamperumal, Lizzie Antony, Nivas Adithan, Abhishek D Shah",India,1-Jan-19,2017,TV-MA,148 min,"Dramas, Independent Movies, International Movies"
s162,Movie,A Christmas Prince: The Royal Wedding,John Schultz,"Rose McIver, Ben Lamb, Alice Krige, Simon Dutton, Honor Kneafsey, Sarah Douglas, Theo Devaney, John Guerrasio, Andy Lucas, Raj Bajaj, Richard Ashton, Billy Angel, Tahirah Sharif, Joel McVeagh",United States,30-Nov-18,2018,TV-PG,93 min,"Children & Family Movies, Dramas, Romantic Movies"
s4464,Movie,Night Comes On,Jordana Spiro,"Dominique Fishback, Tatum Marilyn Hall, Nastashia Fuller, Angel Bismark Curiel, John Earl Jelks, Max Casella, James McDaniel, Cymbal Byrd",United States,27-Aug-20,2018,TV-MA,87 min,"Dramas, Independent Movies"
s7626,Movie,Wildling,Fritz Böhm,"Bel Powley, Brad Dourif, Liv Tyler, Collin Kelly-Sordelet, James Le Gros",United States,1-Apr-20,2018,R,93 min,"Horror Movies, Independent Movies, Sci-Fi & Fantasy"
s765,Movie,Batman: The Killing Joke,Sam Liu,"Kevin Conroy, Mark Hamill, Tara Strong, Ray Wise, John DiMaggio, Robin Atkin Downes, Brian George, JP Karliak, Andrew Kishino, Nolan North",United States,15-Oct-20,2016,R,77 min,Action & Adventure
s2311,Movie,Full Out 2: You Got This!,Jeff Deverett,"Sydney Cope, Logan Edra, Liza Wilk, Braedyn Bruner, Billie Merritt",United States,1-Jan-21,2020,TV-Y,91 min,"Children & Family Movies, Dramas, Sports Movies"
s6615,Movie,The Longshots,Fred Durst,"Ice Cube, Keke Palmer, Tasha Smith, Jill Marie Jones, Dash Mihok, Matt Craven, Glenn Plummer, Garrett Morris, Miles Chandler, Malcolm Goodwin",United States,30-Jan-19,2008,PG,95 min,"Comedies, Dramas, Sports Movies"
s4535,Movie,NOVA: Poisoned Water,Llewellyn M. Smith,Joe Morton,United States,1-Jul-19,2017,TV-PG,54 min,Documentaries
s3438,Movie,Kon-Tiki,"Joachim Rønning, Espen Sandberg","Pål Sverre Hagen, Anders Baasmo Christiansen, Tobias Santelmann, Gustaf Skarsgård, Odd Magnus Williamson, Jakob Oftebro, Agnes Kittelsen, Peter Wight, Amund Hellum Noraker, Eilif Hellum Noraker","United Kingdom, Norway, Denmark, Germany, Sweden",26-Apr-19,2012,PG-13,96 min,"Action & Adventure, Dramas, International Movies"
s6138,Movie,The Black Prince,Kavi Raz,"Satinder Sartaaj, Shabana Azmi, Jason Flemyng, Amanda Root, Rup Magon, Sophie Stevens, Keith Duffy, David Essex, Leanne Joyce, Ranjit Singh Shubh","United Kingdom, India, United States",3-Oct-18,2017,PG-13,121 min,"Dramas, International Movies"
s4571,Movie,Octonauts & the Great Barrier Reef,Blair Simmons,"Simon Greenall, Rob Rackstraw, Jo Wyatt, Paul Buckley, Simon Foster, Teresa Gallagher, Richard Grieve, Michael Murphy, Paul Panting, Keith Wickham",United Kingdom,13-Oct-20,2020,TV-Y,47 min,Children & Family Movies
s835,Movie,Benji,Brandon Camp,"Gabriel Bateman, Darby Camp, Kiele Sanchez, Jerod Haynes, Gralen Bryant Banks, Angus Sampson, Will Rothhaar, Jim Gleason, Brady Permenter","United Arab Emirates, United States",16-Mar-18,2018,TV-PG,87 min,"Children & Family Movies, Dramas"
s4320,Movie,My Fuhrer,Dani Levy,"Helge Schneider, Ulrich Mühe, Sylvester Groth, Adriana Altaras, Stefan Kurt, Ulrich Noethen, Lambert Hamel, Udo Kroschwald, Torsten Michaelis, Axel Werner",Germany,7-May-18,2007,TV-14,91 min,"Comedies, International Movies"
s4690,Movie,OtherLife,Ben C. Lucas,"Jessica De Gouw, T.J. Power, Thomas Cocquerel, Liam Graham, Clarence John Ryan, Maggie Meyer, Tiriel Mora, Priscilla-Anne Forder, Adriane Daff, Ian Toyne","Australia, United Arab Emirates",15-Oct-17,2017,TV-MA,96 min,"Dramas, Independent Movies, International Movies"
s905,Movie,Big Kill,Scott Martin,"Christoph Sanders, Jason Patric, Clint Glenn Hummel, Lou Diamond Phillips, Danny Trejo, Scott Martin, Elizabeth McLaughlin, Stephanie Beran, K.C. Clyde, Michael Paré",United States,18-Jun-19,2018,R,126 min,Action & Adventure
s2974,Movie,In the Shadow of Iris,Jalil Lespert,"Romain Duris, Charlotte Le Bon, Jalil Lespert, Camille Cottin, Adel Bencherif, Sophie Verbeeck, Hélène Barbry","France, Belgium",1-May-17,2016,TV-MA,99 min,"Dramas, International Movies, Thrillers"
s819,Movie,Being Elmo: A Puppeteer's Journey,Constance Marks,"Kevin Clash, Whoopi Goldberg",United States,21-Feb-12,2011,PG,76 min,Documentaries
s6393,Movie,The Giant,"Aitor Arregi, Jon Garaño","Joseba Usabiaga, Eneko Sagardoy, Iñigo Aranburu, Ramón Aguirre, Aia Kruse, Iñigo Azpitarte",Spain,15-Nov-18,2017,TV-14,115 min,"Dramas, International Movies"
s1988,Movie,Emelie,Michael Thelin,"Sarah Bolger, Joshua Rush, Carly Adams, Thomas Bair, Susan Pourfar, Chris Beetem",United States,2-Aug-18,2016,TV-MA,82 min,"Horror Movies, Thrillers"
s2753,Movie,History of Joy,Vishnu Govindhan,"Vishnu Vinay, Vinay Forrt, Saikumar, Joju George, Nobi, Sreekumar, Nandu, Sunil Sukhada",India,1-Aug-18,2017,TV-14,118 min,"Dramas, International Movies"
s6643,Movie,The Married Couples,Hassan AbdulSalam,"Samir Ghanem, George Sidhum, Sherine, Nagah El-Mogui",Egypt,21-May-20,1981,TV-14,195 min,"Comedies, International Movies, Romantic Movies"
s3561,Movie,LeapFrog: Numberland,Ron Myrick,"Jeannie Elias, Kat Feller, Sandy Fox, Cindy Robinson, Richard Rosenblatt",United States,15-Apr-20,2011,TV-Y,33 min,Movies
s4274,Movie,Mujhse Shaadi Karogi,David Dhawan,"Rajpal Yadav, Amrish Puri, Kader Khan, Shashi Kala, Priyanka Chopra, Salman Khan, Akshay Kumar, Satish Shah",India,31-Dec-19,2004,TV-PG,158 min,"Comedies, International Movies, Romantic Movies"
s1680,Movie,Deep,Julio Soto Gurpide,"Justin Felbinger, Stephen Erza  Hughes, Lindsey Alena, Elisabeth Catherine Gray, Dwight Schultz, Anna Vocino","Spain, Belgium, Switzerland, United States, China, United Kingdom",23-Nov-17,2017,PG,93 min,"Children & Family Movies, Comedies"
s1120,Movie,Bruno and Boots: Go Jump in the Pool,Vivieno Caldinelli,"Jonny Gray, Callan Potter, Peter Keleghan, Hannah Vandenbygaart, Kiana Madeira, Joshua Kilimnik, Drew Haytaoglu, Isiah Lea, Scott Thompson, Caroline Rhea",Canada,24-Jun-17,2016,TV-PG,91 min,"Children & Family Movies, Comedies"
s2197,TV Show,Five Came Back,Laurent Bouzereau,"Steven Spielberg, Guillermo del Toro, Lawrence Kasdan, Francis Ford Coppola, Paul Greengrass, Meryl Streep",United States,31-Mar-17,2017,TV-MA,1 Season,Docuseries
s2303,Movie,Frozen River,Courtney Hunt,"Melissa Leo, Misty Upham, Charlie McDermott, Michael O'Keefe, Mark Boone Junior, James Reilly, Jay Klaitz, John Canoe, Dylan Carusona, Michael Sky",United States,1-Jul-19,2008,R,97 min,"Dramas, Independent Movies"
s1419,Movie,Clinical,Alistair Legrand,"Vinessa Shaw, Kevin Rahm, William Atherton, Aaron Stanford, Wilmer Calderon, Sydney Tamiia Poitier, India Eisley, Nestor Serrano",United States,13-Jan-17,2017,TV-MA,104 min,"Horror Movies, Thrillers"
s2086,Movie,F.R.E.D.I.,Sean Olson,"Kelly Hu, Angus Macfadyen, Candace Cameron Bure, Lucius Hoyos, Reid Miller, Tyler Christopher, Casimere Jollette, Christina Cox, Texas Battle, Harvey Guillen",United States,15-Dec-18,2018,TV-PG,90 min,"Children & Family Movies, Sci-Fi & Fantasy"
s1513,Movie,Covered: Alive in Asia,"Micah Bickham, Galley Molina",Israel Houghton,United States,31-Mar-16,2016,TV-G,75 min,"Documentaries, Faith & Spirituality, Music & Musicals"
s6601,Movie,The Little Mermaid,"Blake Harris, Chris Bouchard","William Moseley, Poppy Drayton, Loreto Peralta, Armando Gutierrez, Shirley MacLaine, Gina Gershon, Shanna Collins, Chris Yong, Jo Marie Payton, Tom Nowicki",United States,1-Dec-18,2018,PG,85 min,"Children & Family Movies, Dramas"
s7256,Movie,True: Wuzzle Wegg Day,"Todd Kauffman, Mark Thornton","Michela Luci, Jamie Watson, Eric Peterson, Anna Claire Bartlam, Nicolas Aqui, Cory Doran, Julie Lemieux",Canada,27-Mar-20,2020,TV-Y,24 min,Children & Family Movies
s4540,Movie,Nova: Ultimate Mars Challenge,Gail Willumsen,Lance Lewman,United States,1-Jul-19,2012,TV-G,53 min,Movies
s6932,Movie,The Time Traveler's Wife,Robert Schwentke,"Rachel McAdams, Eric Bana, Arliss Howard, Ron Livingston, Stephen Tobolowsky, Michelle Nolden, Jane McLean, Hailey McCann, Tatum McCann, Brooklynn Proulx, Alex Ferris",United States,1-Oct-19,2009,PG-13,107 min,"Dramas, Romantic Movies, Sci-Fi & Fantasy"
s6706,Movie,The Next Karate Kid,Christopher Cain,"Pat Morita, Hilary Swank, Michael Ironside, Constance Towers, Chris Conrad, Arsenio ""Sonny"" Trinidad, Michael Cavalieri, Walton Goggins",United States,1-Nov-20,1994,PG,107 min,"Action & Adventure, Dramas, Sports Movies"
s2949,Movie,Iliza Shlesinger: War Paint,Jay Chapman,Iliza Shlesinger,United States,1-Sep-13,2013,NR,75 min,Stand-Up Comedy
s7146,Movie,Tony Parker: The Final Shot,Florent Bodin,Tony Parker,France,6-Jan-21,2020,TV-14,99 min,"Documentaries, International Movies, Sports Movies"
s731,Movie,Barakah Meets Barakah,Mahmoud Sabbagh,"Hisham Fageeh, Fatima Al-Banawi, Sami Hifny, Khairia Nazmi, Abdulmajeed Al-Ruhaidi",Saudi Arabia,12-Oct-17,2016,TV-MA,88 min,"Comedies, International Movies, Romantic Movies"
s2415,Movie,GIMS: On the Record,Florent Bodin,Maître Gims,France,17-Sep-20,2020,TV-MA,96 min,"Documentaries, International Movies, Music & Musicals"
s6599,Movie,The Lion Woman,Vibeke Idsøe,"Rolf Lassgård, Kjersti Tveterås, Rolf Kristian Larsen, Ole Johan Skjelbred-Knutsen, Karen-Lise Mynster, Ida Ursin-Holm, Lisa Loven Kongsli, Connie Nielsen, Henrik Mestad, Kåre Conradi, Mathilde Thomine Storm","Norway, Germany",1-Oct-17,2016,TV-14,118 min,"Dramas, International Movies"
s3372,Movie,Kidnapping Mr. Heineken,Daniel Alfredson,"Jim Sturgess, Sam Worthington, Ryan Kwanten, Anthony Hopkins, Mark van Eeuwen, Thomas Cocquerel, Jemima West, David Dencik","Netherlands, Belgium, United Kingdom, United States",8-Sep-17,2015,R,95 min,"Action & Adventure, Dramas, International Movies"
s3660,Movie,Little Evil,Eli Craig,"Adam Scott, Evangeline Lilly, Bridget Everett, Owen Atlas, Chris D'Elia, Donald Faison, Clancy Brown, Tyler Labine, Kyle Bornheimer, Carla Gallo, Brad Williams, Sally Field",United States,1-Sep-17,2017,TV-MA,95 min,"Comedies, Horror Movies"
s6550,Movie,The Larva Island Movie,Ahn Byoung-wook,"Hong Bum-ki, Eddy Lee, Kang Shi-hyun, Ahn Hyo-min, Kim Yeon-woo, Choi Nak-yoon, Tom Wayland, Erica Schroeder",South Korea,23-Jul-20,2020,TV-Y7,91 min,"Children & Family Movies, Comedies"
s1779,Movie,Disconnect,"David 'Tosh' Gitonga, Michael Jones","Brenda Wairimu, Nick Mutuma, Catherine Kamau, Pascal Tokodi, Patricia Kihoro, Pierra Makena, Bridget Shighadi, Brian Ogola, Illya Frank, Aseem Sharma, Arthur Sanya, Justin Mirichii, Maqbul Mohammed",Kenya,16-Oct-20,2018,TV-MA,107 min,"Comedies, International Movies, Romantic Movies"
s3826,Movie,Lusers,Ticoy Rodriguez,"Carlos Alcántara, Pablo Granados, Felipe Izquierdo, Gaby Espino, Cristián de la Fuente, Marcela Guerty, Claudio Torres","Argentina, Chile, Peru",15-Jul-16,2015,TV-MA,100 min,"Comedies, International Movies, Sports Movies"
s3327,Movie,Katti Batti,Nikhil Advani,"Imran Khan, Kangana Ranaut, Abhishek Saha, Mithila Palkar, Vivan Bhatena, Suhaas Ahuja, Nicole Faria, Adaar Malik",India,1-Nov-18,2015,TV-14,132 min,"Comedies, Dramas, International Movies"
s7505,Movie,We Belong Together,Chris Stokes,"Charles Malik Whitfield, Draya Michele, Elise Neal, Cassidey Fralin, Brian White, Valarie Pettiford, Gary Anthony Sturgis, Jessica Vanessa DeLeon",United States,16-Jul-19,2018,TV-14,83 min,Thrillers
s7468,Movie,Walk with Me,"Marc Francis, Max Pugh","Benedict Cumberbatch, Thich Nhat Hanh",United Kingdom,26-Dec-17,2017,TV-PG,94 min,Documentaries
s7395,Movie,Vaya,Akin Omotoso,"Mncedisi Shabangu, Sihle Xaba, Sibusiso Msimang, Zimkhitha Nyoka, Warren Masemola, Nomonde Mbusi, Azwile Chamane, Harriet Lenabe",South Africa,1-Nov-18,2016,TV-MA,106 min,"Dramas, Independent Movies, International Movies"
s2309,Movie,Full Count,Robert Eagar,"John Paul Kakos, Natalia Livingston, E. Roger Mitchell, Rick Hearst, Jason London, Victoria Elizabeth Staley, Adam Boyer",United States,23-Feb-20,2019,TV-PG,110 min,"Children & Family Movies, Dramas, Faith & Spirituality"
s6881,Movie,The Smurfs,Raja Gosnell,"Hank Azaria, Neil Patrick Harris, Jayma Mays, Sofía Vergara, Tim Gunn, Jonathan Winters, Katy Perry, Alan Cumming, Fred Armisen, George Lopez, Anton Yelchin, Kenan Thompson, Jeff Foxworthy, John Oliver, Wolfgang Puck, B.J. Novak, Paul Reubens","United States, Belgium, Canada",1-Sep-20,2011,PG,103 min,"Children & Family Movies, Comedies"
s1079,Movie,Brave Blue World: Racing to Solve Our Water Crisis,Tim Neeves,"Liam Neeson, Matt Damon, Jaden Smith","Canada, United Kingdom",21-Oct-20,2020,TV-PG,51 min,"Documentaries, International Movies"
s2697,Movie,"Hello, Privilege. It's Me, Chelsea",Alex Stapleton,Chelsea Handler,United States,13-Sep-19,2019,TV-MA,65 min,Documentaries
s6325,Movie,The Edge of Seventeen,Kelly Fremon Craig,"Hailee Steinfeld, Woody Harrelson, Kyra Sedgwick, Haley Lu Richardson, Blake Jenner, Hayden Szeto","United States, China",1-Feb-19,2016,R,105 min,"Comedies, Dramas"
s6172,Movie,The Brave One,Neil Jordan,"Jodie Foster, Terrence Howard, Naveen Andrews, Carmen Ejogo, Nicky Katt, Mary Steenburgen, Lenny Venito, Zoë Kravitz, Jane Adams, Gordon MacDonald",United States,1-Nov-19,2007,R,122 min,"Dramas, Thrillers"
s2300,TV Show,Frozen Planet,Alastair Fothergill,David Attenborough,"United Kingdom, United States, Spain, Germany, Greece, Canada",28-Jan-16,2011,TV-PG,1 Season,"British TV Shows, Docuseries, International TV Shows"
