show_id,type,title,director,cast,country,date_added,release_year,rating,duration,listed_in
s3875,Movie,Maine Pyaar Kyun Kiya,David Dhawan,"Salman Khan, Sushmita Sen, Sohail Khan, Katrina Kaif, Arshad Warsi, Isha Koppikar, Rajpal Yadav, Beena Kak",India,31-Dec-19,2005,TV-14,137 min,"Comedies, International Movies, Music & Musicals"
s1498,Movie,Cool Hand Luke,Stuart Rosenberg,"Paul Newman, George Kennedy, J.D. Cannon, Lou Antonio, Robert Drivas, Strother Martin, Jo Van Fleet, Harry Dean Stanton, Dennis Hopper, Joe Don Baker, James Gammon, Wayne Rogers",United States,1-Jan-21,1967,TV-14,127 min,"Classic Movies, Dramas"
s3923,Movie,Manusangada,Amshan Kumar,"Rajeev Anand, Manimegalai, A.S. Sasi Kumar, Vidhur Rajarajan, Sheela Rajkumar, Sethu Darwin, Anand Sampath, Karuna Prasad",India,2-Feb-19,2017,TV-14,93 min,"Dramas, Independent Movies, International Movies"
s3119,TV Show,James Acaster: Repertoire,Dan Lucchesi,James Acaster,United Kingdom,27-Mar-18,2018,TV-14,1 Season,"British TV Shows, International TV Shows, Stand-Up Comedy & Talk Shows"
s947,Movie,Black & Privileged: Volume 1,Mark Harris,"Dawnisha Halfkenny, Simeon Henderson, Corey Hendrix, Malcom Banks, Nadia Simms, Brian White, Brely Evans, Cynda Williams, Carl Anthony Payne II",United States,12-Jul-19,2019,TV-MA,79 min,Dramas
s1812,Movie,Don't Be Afraid of the Dark,Troy Nixey,"Katie Holmes, Guy Pearce, Bailee Madison, Jack Thompson, Garry McDonald, Alan Dale, Julia Blake, Edwina Ritchard, Emilia Burns, Guillermo del Toro","United States, Australia, Mexico",2-Nov-19,2010,R,99 min,Horror Movies
s5068,Movie,Rahasya,Manish Gupta,"Kay Kay Menon, Ashish Vidyarthi, Tisca Chopra, Mita Vashisht, Bikramjeet Kanwarpal, Ashwini Kalsekar, Kunal Sharma, Nimai Bali",India,1-Mar-18,2015,TV-14,117 min,"Dramas, International Movies"
s258,Movie,A Yellow Bird,K. Rajagopal,"Sivakumar Palakrishnan, Huang Lu, Seema Biswas, Udaya Soundari, Nithiyia Rao, Indra Chandran","Singapore, France",1-May-17,2016,TV-MA,111 min,"Dramas, Independent Movies, International Movies"
s1246,Movie,Catfight,Onur Tukel,"Sandra Oh, Anne Heche, Alicia Silverstone, Amy Hill, Myra Lucretia Taylor, Ariel Kavoussi, Damian Young, Stephen Gevedon, Giullian Yao Gioiello, Tituss Burgess",United States,1-Jun-17,2016,TV-MA,96 min,"Comedies, Independent Movies"
s7668,Movie,World Trade Center,Oliver Stone,"Nicolas Cage, Michael Peña, Maggie Gyllenhaal, Maria Bello, Stephen Dorff, Jay Hernandez, Michael Shannon, Frank Whaley, Jon Bernthal, Morgan Flynn, Nick Damici, Viola Davis, William Mapother",United States,20-Nov-19,2006,PG-13,129 min,"Action & Adventure, Dramas"
s1037,Movie,Bon Bini Holland,Jelle de Jonge,"Jandino Asporaat, Liliana de Vries, Teun Kuilboer, Sergio IJssel, Dennis Rudge, Alpha Oumar Barry, Phi Nguyen",Netherlands,1-Sep-16,2015,TV-MA,88 min,"Comedies, International Movies"
s537,Movie,Ankhon Dekhi,Rajat Kapoor,"Sanjay Mishra, Seema Pahwa, Rajat Kapoor, Taranjit Kaur, Maya Sarao, Chandrachoor Rai, Namit Das, Brijendra Kala, Alka Chawla, Manu Rishi Chadha",India,28-Sep-20,2013,TV-PG,104 min,"Dramas, Independent Movies, International Movies"
s1703,Movie,Denis Leary: No Cure For Cancer,Ted Demme,Denis Leary,United States,8-Aug-17,1992,R,62 min,Stand-Up Comedy
s2365,Movie,Gbomo Gbomo Express,Walter Taylaur,"Ramsey Nouah, Gideon Okeke, Osas Ighodaro Ajibade, Blossom Chukwujekwu, Kiki Omeili, Gbenro Ajibade, Ikechukwu, Alexx Ekubo, Shaffy Bello",Nigeria,26-Feb-20,2015,TV-MA,97 min,"Dramas, International Movies"
s3244,Movie,Jumping the Broom,Salim Akil,"Angela Bassett, Paula Patton, Laz Alonso, Loretta Devine, Meagan Good, Tasha Smith, Julie Bowen, DeRay Davis, Valarie Pettiford, Pooch Hall, Tenika Davis, T.D. Jakes, Mike Epps, Romeo Miller, Marguerite McNeil, El DeBarge, Brian Stokes Mitchell, Gary Dourdan",United States,1-Nov-20,2011,PG-13,113 min,"Comedies, Romantic Movies"
s6698,Movie,The Naked Gun: From the Files of Police Squad!,David Zucker,"Leslie Nielsen, Priscilla Presley, George Kennedy, Ricardo Montalban, O.J. Simpson, Raye Birk, Susan Beaubian, Nancy Marchand",United States,1-Jan-21,1988,PG-13,85 min,"Comedies, Cult Movies"
s1652,Movie,Dead Kids,Mikhail Red,"Khalil Ramos, Vance Larena, Kelvin Miranda, Jan Silverio, Markus Paterson, Gabby Padilla, Sue Ramirez","Philippines, United States",1-Dec-19,2019,TV-MA,94 min,"Dramas, International Movies, Thrillers"
s2324,Movie,G-Force,Hoyt Yeatman,"Bill Nighy, Will Arnett, Zach Galifianakis, Kelli Garner, Tyler Patrick Jones, Piper Mackenzie Harris, Gabriel Casseus, Jack Conley, Niecy Nash, Justin Mentell, Nicolas Cage, Sam Rockwell, Jon Favreau, Penélope Cruz, Steve Buscemi, Tracy Morgan",United States,15-Mar-19,2009,PG,88 min,"Children & Family Movies, Comedies"
s2326,Movie,Görümce,Kıvanç Baruönü,"Eda Ece, Dilşah Demir, Gupse Özay, Buğra Gülsoy",Turkey,28-Apr-20,2016,TV-MA,104 min,"Comedies, International Movies, Music & Musicals"
s4300,Movie,Mutiny of the Worker Bees,Carlos Morett,"Gustavo Egelhaaf, Alejandro Suárez, Bárbara de Regil, Mauricio Argüelles, César Rodríguez, Fernando Becerril, Anna Carreiro, Carlos Macías, José Sefami, Raquel Garza",Mexico,20-May-20,2020,TV-MA,94 min,"Comedies, International Movies"
s5635,Movie,Sinister Circle,Dorian Fernández-Moris,"Milene Vázquez, Matías Raygada, Claudia Dammert, Marcello Rivera, Atilia Boschetti, Hernán Romero, Ismael Contreras, Pietro Sibille, Leslie Shaw",Peru,1-Oct-19,2017,TV-MA,87 min,"Horror Movies, International Movies"
s6920,Movie,The Taking of Pelham 123,Tony Scott,"Denzel Washington, John Travolta, Luis Guzmán, Victor Gojcaj, Robert Vataj, John Turturro, Michael Rispoli, Ramon Rodriguez, James Gandolfini, John Benjamin Hickey, Alex Kaluzhsky, Gbenga Akinnagbe","United States, United Kingdom",1-Sep-19,2009,R,106 min,Action & Adventure
s5003,Movie,Pulp Fiction,Quentin Tarantino,"John Travolta, Samuel L. Jackson, Uma Thurman, Harvey Keitel, Tim Roth, Amanda Plummer, Maria de Medeiros, Ving Rhames, Eric Stoltz, Rosanna Arquette, Christopher Walken, Bruce Willis",United States,1-Jan-19,1994,R,154 min,"Classic Movies, Cult Movies, Dramas"
s1808,Movie,Don,Farhan Akhtar,"Shah Rukh Khan, Priyanka Chopra, Arjun Rampal, Isha Koppikar, Kareena Kapoor, Boman Irani, Om Puri, Pavan Malhotra",India,15-Dec-19,2006,TV-14,169 min,"Action & Adventure, International Movies"
s7558,Movie,What Keeps You Alive,Colin Minihan,"Hannah Emily Anderson, Brittany Allen, Martha MacIsaac, Joey Klein, Charlotte Lindsay Marron",Canada,1-Aug-20,2018,R,99 min,"LGBTQ Movies, Thrillers"
s1671,Movie,Death Can Wait,Fernando Ayllón,"Ricardo Quevedo, Nelson Polanía, Liss Pereira, Brian Moreno, Ana Cristina Botero, Jairo Ordóñez, Luis Alberto Saavedra, Blanca Ligia Franco, Marianne Schaller Romero, Shirley Marulanda",Colombia,2-May-20,2020,TV-14,91 min,"Comedies, International Movies"
s6939,Movie,The Tree of Blood,Julio Medem,"Úrsula Corberó, Álvaro Cervantes, Najwa Nimri, Patricia López Arnaiz, Daniel Grao, Joaquín Furriel, Maria Molins, Emilio Gutiérrez Caba, Luisa Gavasa, José María Pou, Ángela Molina",Spain,8-Feb-19,2018,TV-MA,136 min,"Dramas, Independent Movies, International Movies"
s918,Movie,Bill Burr: Walk Your Way Out,Jay Karas,Bill Burr,United States,31-Jan-17,2017,TV-MA,78 min,Stand-Up Comedy
s7771,Movie,Zinzana,Majid Al Ansari,"Ali Suliman, Saleh Bakri, Yasa, Ali Al-Jabri, Mansoor Alfeeli, Ahd","United Arab Emirates, Jordan",9-Mar-16,2015,TV-MA,96 min,"Dramas, International Movies, Thrillers"
s1672,Movie,Death House,Harrison Smith,"Cody Longo, Cortney Palm, Adrienne Barbeau, Michael Berryman, Barbara Crampton, Sid Haig, Gunnar Hansen, Lindsay Hartley, Kane Hodder, Lloyd Kaufman, Camille Keaton, Bill Moseley, Tony Todd, Dee Wallace, Vincent Ward, Vernon Wells",United States,5-May-19,2017,R,88 min,Horror Movies
s4556,Movie,Nymphomaniac: Volume II,Lars von Trier,"Charlotte Gainsbourg, Stellan Skarsgård, Stacy Martin, Shia LaBeouf, Christian Slater, Jamie Bell, Uma Thurman, Willem Dafoe, Mia Goth, Sophie Kennedy Clark, Michael Pas, Stellan Skarsgard","Denmark, Germany, Belgium, United Kingdom, France, Sweden",25-Aug-18,2013,TV-MA,124 min,"Dramas, Independent Movies, International Movies"
s2950,Movie,Illang: The Wolf Brigade,Kim Jee-woon,"Gang Dong-won, Han Hyo-joo, Jung Woo-sung, Kim Mu-yeol, Han Ye-ri, Choi Min-ho, Shin Eun-soo, Kim Beop-rae, Lee Dong-ha, Jung Won-joong, Choi Jin-ho",South Korea,19-Oct-18,2018,TV-MA,140 min,"Action & Adventure, International Movies, Sci-Fi & Fantasy"
s4201,Movie,Monster Island,Leopoldo Aguilar,"Joey Camen, Fiona Hardingham, Johnny Rose, Katie Leigh, Roger L. Jackson, Wally Wingert, Phillip Vasquez","India, Mexico",1-Dec-17,2017,TV-Y7,81 min,Children & Family Movies
s5795,Movie,Stardust,Matthew Vaughn,"Claire Danes, Michelle Pfeiffer, Robert De Niro, Charlie Cox, Sienna Miller, Ricky Gervais, Jason Flemyng, Rupert Everett, Peter O'Toole, Mark Strong, Kate Magowan, Ian McKellen","United Kingdom, United States",1-Jul-20,2007,PG-13,128 min,"Action & Adventure, International Movies, Romantic Movies"
s3107,Movie,Jacob's Ladder,David M. Rosenthal,"Michael Ealy, Jesse Williams, Nicole Beharie, Guy Burnet, Joseph Sikora, Karla Souza, Ritchie Coster, Jon Eyez",United States,22-Dec-19,2019,R,90 min,Thrillers
s1182,TV Show,Call the Midwife,Philippa Lowthorpe,"Vanessa Redgrave, Bryony Hannah, Helen George, Jenny Agutter, Pam Ferris, Laura Main, Judy Parfitt, Cliff Parisi, Stephen McGann, Ben Caplan, Miranda Hart, Jessica Raine, Max Macmillan, Victoria Yeates, Jack Ashton, Emerald Fennell, Linda Bassett",United Kingdom,15-Sep-20,2020,TV-MA,9 Seasons,"British TV Shows, International TV Shows, TV Dramas"
s3039,Movie,Inuyasha the Movie - La spada del dominatore del mondo,Toshiya Shinohara,"Kappei Yamaguchi, Satsuki Yukino, Koji Tsujitani, Houko Kuwashima, Kumiko Watanabe, Ken Narita, Akio Otsuka, Kikuko Inoue",Japan,1-Sep-17,2003,TV-14,99 min,"Action & Adventure, Anime Features, International Movies"
s4409,Movie,Naruto Shippuden: The Movie,Hajime Kamegaki,"Junko Takeuchi, Chie Nakamura, Yoichi Masukawa, Kôichi Tôchika, Masako Katsuki, Keiko Nemoto, Kazuhiko Inoue, Masashi Ebara, Showtaro Morikubo, Romi Park, Ayumi Fujimura, Fumiko Orikasa",Japan,15-Oct-16,2007,TV-PG,95 min,"Action & Adventure, Anime Features, International Movies"
s1853,Movie,Dragonheart: Battle for the Heartfire,Patrik Syversen,"Tom Rhys Harries, Jessamine-Bliss Bell, Patrick Stewart, André Eriksen, Richard Cordery, Martin Hutson, Turlough Convery, Delroy Brown, Tamzin Merchant",United States,13-Jun-17,2017,PG-13,98 min,"Action & Adventure, Sci-Fi & Fantasy"
s5686,Movie,So Much Love to Give,Marcos Carnevale,"Adrián Suar, Soledad Villamil, Gabriela Toscano, Alan Sabbagh, Darío Barassi, Magela Zanotta, Betiana Blum",Argentina,9-Sep-20,2020,TV-14,108 min,"Comedies, International Movies, Music & Musicals"
s1505,Movie,Cosmos Laundromat: First Cycle,Mathieu Auvray,"Pierre Bokma, Reinout Scholten van Aschat",Netherlands,4-Jun-19,2015,TV-MA,12 min,"Dramas, International Movies, Sci-Fi & Fantasy"
s4291,Movie,Murder Party,Jeremy Saulnier,"Alex Barnett, Macon Blair, Paul Goldblatt, Stacy Rock, William Lacey, Beau Sia, Skei Saulnier, Chris Sharp, Bill Tangradi",United States,1-Sep-18,2007,NR,79 min,"Comedies, Cult Movies, Horror Movies"
s477,Movie,American Warfighter,Jerry G. Angelo,"Jerry G. Angelo, Paul Logan, Joshua Santana, Carolina Castro, David Robbins, Michael King, Tom Crisp, Jennifer Marshall, Victoria Clare, Ryan Baumann, Isaac C. Singleton Jr., Said Faraj",United States,13-Sep-19,2019,TV-MA,106 min,Dramas
s6080,Movie,The American Meme,Bert Marcus,"Paris Hilton, Josh Ostrovsky, Brittany Furlan, Kirill Bichutsky, DJ Khaled, Emily Ratajkowski, Hailey Baldwin",United States,7-Dec-18,2018,TV-MA,98 min,Documentaries
s503,Movie,Anchor and Hope,Carlos Marques-Marcet,"Oona Chaplin, Natalia Tena, David Verdaguer, Geraldine Chaplin",Spain,15-Feb-19,2017,TV-MA,113 min,"Comedies, Dramas, LGBTQ Movies"
s7420,Movie,Vikings Unearthed,Harvey Lilley,Eric Meyers,United States,1-Mar-17,2016,TV-PG,113 min,Documentaries
s3965,Movie,Marvel's Hulk: Where Monsters Dwell,Mitch Schauer,"Fred Tatasciore, Liam O'Brien, Jesse Burch, Edward Bosco, Chiara Zanni, Mike Vaughn, Jon Olson, Matthew Waterson, Zach Callison, Laura Bailey, Hope Levy",United States,4-Jan-17,2016,PG,75 min,"Children & Family Movies, Sci-Fi & Fantasy"
s3780,Movie,Love Wedding Repeat,Dean Craig,"Sam Claflin, Olivia Munn, Freida Pinto, Eleanor Tomlinson, Joel Fry, Tim Key, Aisling Bea, Jack Farthing, Allan Mustafa","United Kingdom, Italy",10-Apr-20,2020,TV-MA,101 min,"Comedies, International Movies, Romantic Movies"
s359,Movie,Ajab Prem Ki Ghazab Kahani,Rajkumar Santoshi,"Ranbir Kapoor, Katrina Kaif, Govind Namdeo, Darshan Jariwala, Zakir Hussain, Smita Jaykar, Navneet Nishan, Dolly Bindra, Upen Patel",India,25-Oct-20,2009,TV-14,150 min,"Comedies, International Movies, Music & Musicals"
s4416,Movie,Natalia Valdebenito: El especial,"Raúl Campos, Jan Suter",Natalia Valdebenito,Chile,2-Mar-18,2018,TV-MA,69 min,Stand-Up Comedy
s5633,Movie,Singularity,Robert Kouba,"Julian Schaffner, John Cusack, Jeannine Wacker, Carmen Argenziano, Eileen Grubba, Pavlo Bubryak","Switzerland, United States",1-Jun-18,2017,PG-13,92 min,"Action & Adventure, Dramas, Sci-Fi & Fantasy"
s5949,Movie,Swordfish,Dominic Sena,"John Travolta, Hugh Jackman, Halle Berry, Don Cheadle, Sam Shepard, Vinnie Jones, Drea de Matteo, Rudolf Martin, Zach Grenier, Camryn Grimes",United States,1-Jul-19,2001,R,99 min,Action & Adventure
s7282,Movie,Twins Mission,To-hoi Kong,"Sammo Kam-Bo Hung, Gillian Chung, Charlene Choi, Wu Jing, Yuen Wah, Jess Zhang, Steven Cheung, Lier Qiu, Shek Sau, Sam Lee, Andy Liang","Hong Kong, China",21-Jul-19,2007,TV-MA,102 min,"Action & Adventure, International Movies"
s693,Movie,Bad Grandpa .5,Jeff Tremaine,"Johnny Knoxville, Jackson Nicoll, Greg Harris, Georgina Cates, Kamber Hejlik, Jill Killington, Madison Davis, George Faughnan, Spike Jonze, Catherine Keener",United States,1-Jan-21,2014,TV-MA,87 min,Comedies
s60,Movie,1000 Rupee Note,Shrihari Sathe,"Usha Naik, Sandeep Pathak, Shrikant Yadav, Ganesh Yadav, Pooja Nayak, Devendra Gaikwad",India,1-Dec-16,2014,TV-14,89 min,"Dramas, International Movies"
s297,Movie,Across The Line,Julien Christian Lutz,"Sarah Jeffery, Simon Paul Mutuyimana, Denis Theriault, Jeremiah Sparks, Steven Love, Cara Ricketts, Jim Codrington, Shamier Anderson, Stephan James, Lanette Ware, Hugh Thompson",Canada,1-Apr-19,2015,TV-MA,88 min,"Dramas, Sports Movies"
s1895,Movie,Dumplin',Anne Fletcher,"Danielle Macdonald, Jennifer Aniston, Odeya Rush, Maddie Baillio, Bex Taylor-Klaus, Luke Benward, Georgie Flores, Dove Cameron, Harold Perrineau, Kathy Najimy, Ginger Minj, Hilliary Begley",United States,7-Dec-18,2018,PG-13,110 min,"Comedies, Dramas, Independent Movies"
s592,Movie,"As Above, So Below",John Erick Dowdle,"Perdita Weeks, Ben Feldman, Edwin Hodge, François Civil, Marion Lambert, Ali Marhyar, Cosme Castro, Hamid Djavadan, Théo Cholbi, Emy Lévy",United States,16-Sep-18,2014,R,93 min,"Horror Movies, Thrillers"
s766,Movie,Battle,Katarina Launing,"Lisa Teige, Fabian Svegaard Tapia, Vebjørn Enger, Charlott Madeleine Utzig, Stig R. Amdam, Karen-Lise Mynster","Norway, Denmark, Netherlands, Sweden",1-Dec-18,2018,TV-MA,98 min,"Dramas, International Movies, Romantic Movies"
s1734,Movie,Dhan Dhana Dhan Goal,Vivek Agnihotri,"John Abraham, Bipasha Basu, Arshad Warsi, Shernaz Patel, Boman Irani, Dibyendu Bhattacharya, Gilbert Montoya, Dalip Tahil, Rajendranath Zutshi","United Kingdom, India",1-Nov-18,2007,TV-14,157 min,"Dramas, Music & Musicals, Sports Movies"
s6718,Movie,The Occupant,"Àlex Pastor, David Pastor","Javier Gutiérrez, Mario Casas, Bruna Cusí, Ruth Díaz",Spain,25-Mar-20,2020,TV-MA,104 min,"Independent Movies, International Movies, Thrillers"
s1889,Movie,Duck Duck Goose,Chris Jenkins,"Jim Gaffigan, Zendaya, Lance Lim, Greg Proops, Reggie Watts, Carl Reiner, Jennifer Grey, Stephen Fry, Diedrich Bader, Natasha Leggero, Craig Ferguson, Rick Overton","China, United States, United Kingdom",20-Jul-18,2018,PG,92 min,"Children & Family Movies, Comedies"
s5026,Movie,QLIMAX THE SOURCE,"Daan Jansen, Stijn Verlinde","Michael Brons, Nigel Coppen, Thomas Velderman, Carlos Antunes, Marco Spronk, Willem Rebergen, Joshua Dutrieux, Bob van der Palen, Sefa Vlaarkamp",Netherlands,22-Dec-20,2020,TV-14,57 min,Music & Musicals
s6350,Movie,The Figurine (Araromire),Kunle Afolayan,"Ramsey Nouah, Omoni Oboli, Kunle Afolayan, Funlola Aofiyebi, Tosin Sido, David J. Oserwe, Kate Adepegba, Muraina Oyelami, Wale Adebayo, Ombo Gogo Ombo",Nigeria,1-Oct-19,2009,TV-14,121 min,"Horror Movies, International Movies, Thrillers"
s3142,Movie,Jeff Foxworthy and Larry the Cable Guy: We’ve Been Thinking...,Jay Karas,"Jeff Foxworthy, Larry the Cable Guy",United States,26-Aug-16,2016,TV-14,75 min,Stand-Up Comedy
s5059,Movie,Radiopetti,Hari Viswanath,"Lakshmanan, TVV Ramanujam, Shobana, Nivas Adithan, Indhumathi, Baby Maya, Master Rohan",India,1-Jan-17,2015,TV-PG,83 min,"Dramas, International Movies"
s2813,Movie,Horse Girl,Jeff Baena,"Alison Brie, Debby Ryan, Paul Reiser, John Reynolds, Molly Shannon, John Ortiz, Meredith Hagner, Jake Picking, David Paymer, Jay Duplass",United States,7-Feb-20,2020,R,104 min,"Dramas, Independent Movies"
s7243,Movie,True Grit,Henry Hathaway,"John Wayne, Glen Campbell, Kim Darby, Jeremy Slate, Robert Duvall, Dennis Hopper, Alfred Ryder, Strother Martin, Jeff Corey",United States,1-Jan-20,1969,G,128 min,"Classic Movies, Dramas"
s3038,Movie,Inuyasha the Movie - L'isola del fuoco scarlatto,Toshiya Shinohara,"Kappei Yamaguchi, Satsuki Yukino, Koji Tsujitani, Houko Kuwashima, Kumiko Watanabe, Noriko Hidaka, Ken Narita, Cho, Mamiko Noto, Nobutoshi Canna, Fumiko Orikasa, Richard Ian Cox, Moneca Stori",Japan,1-Sep-17,2004,TV-PG,88 min,"Action & Adventure, Anime Features, International Movies"
s5378,Movie,Sanju,Rajkumar Hirani,"Ranbir Kapoor, Vicky Kaushal, Paresh Rawal, Sonam Kapoor, Dia Mirza, Jim Sarbh, Anushka Sharma, Manisha Koirala, Boman Irani",India,15-Oct-18,2018,TV-MA,159 min,"Dramas, International Movies"
s4836,Movie,Peter and the Farm,Tony Stone,Peter Dunning,United States,9-Mar-17,2016,TV-MA,92 min,Documentaries
s4633,Movie,Once Upon a Time in London,Simon Rumley,"Leo Gregory, Terry Stone, Doug Allen, Andy Beckwith, Kate Braithwaite, Holly Earl, Joe Egan, Nadia Forde",United Kingdom,15-Apr-20,2019,TV-MA,111 min,"Dramas, International Movies"
s2068,Movie,Expelled from Paradise,Seiji Mizushima,"Rie Kugimiya, Wendee Lee, Shinichiro Miki, Steve Blum, Hiroshi Kamiya, Johnny Yong Bosch",Japan,25-Jun-18,2014,TV-MA,103 min,"Action & Adventure, Anime Features, Sci-Fi & Fantasy"
s7314,TV Show,Unabomber - In His Own Words,Mick Grogan,Ted Kaczynski,Canada,22-Feb-20,2018,TV-MA,1 Season,"Crime TV Shows, Docuseries"
s901,Movie,Big Bear,Joey Kern,"Joey Kern, Adam Brody, Zachary Knighton, Tyler Labine, Pablo Schreiber, Toby Huss, Heidi Heaslet, Ahna O'Reilly",United States,28-Feb-18,2017,TV-MA,87 min,Comedies
s2756,Movie,Hit & Run,"David Palmer, Dax Shepard","Kristen Bell, Dax Shepard, Kristin Chenoweth, Tom Arnold, Bradley Cooper, Jess Rowland, Ryan Hansen, Beau Bridges, Michael Rosenbaum, David Koechner, Joy Bryant",United States,8-Nov-19,2012,R,100 min,"Action & Adventure, Comedies, Romantic Movies"
s3283,Movie,Kabhi Khushi Kabhie Gham,Karan Johar,"Amitabh Bachchan, Jaya Bhaduri, Shah Rukh Khan, Kajol, Hrithik Roshan, Kareena Kapoor, Rani Mukerji, Farida Jalal, Himani Shivpuri, Alok Nath",India,1-Apr-20,2001,TV-14,209 min,"Dramas, International Movies"
s7029,Movie,The Young Offenders,Peter Foott,"Alex Murphy, Chris Walley, Hilary Rose, Dominic MacHale, P.J. Gallagher, Shane Casey, Pascal Scott, Michael Sands, Ciaran Bermingham",Ireland,9-Mar-17,2016,TV-MA,83 min,"Comedies, International Movies"
s3469,Movie,Kung Fu Yoga,Stanley Tong,"Jackie Chan, Disha Patani, Amyra Dastur, Sonu Sood, Aarif Rahman, Miya Muqi, Zhang Yixing, Eric Tsang","China, India, Nepal",6-Oct-17,2017,TV-PG,107 min,"Action & Adventure, Comedies, International Movies"
s6093,Movie,The Art of Loving,Maria Sadowska,"Magdalena Boczarska, Eryk Lubos, Justyna Wasilewska, Piotr Adamczyk, Arkadiusz Jakubik, Wojciech Mecwaldowski, Borys Szyc, Katarzyna Kwiatkowska, Artur Barciś",Poland,15-Mar-18,2017,TV-MA,115 min,"Dramas, International Movies"
s1804,Movie,Dolly Parton’s Christmas on the Square,Debbie Allen,"Dolly Parton, Christine Baranski, Treat Williams, Jenifer Lewis, Josh Segarra, Jeanine Mason, Mary Lane Haskell",United States,22-Nov-20,2020,TV-PG,99 min,"Children & Family Movies, Music & Musicals"
s6751,Movie,The Perfect Picture: Ten Years Later,Shirley Frimpong-Manso,"Jackie Appiah, Naa Ashorkor Mensa-Doku, Lydia Forson, Adjetey Anang, Richard Mofe-Damijo, Chris Attoh, Gideon Okeke, Joselyn Dumas, John Dumelo, Beverly Naya",Ghana,3-Jul-20,2019,TV-MA,148 min,"Comedies, Dramas, International Movies"
s1943,Movie,El último testigo,Philipp Stölzl,"Aaron Eckhart, Liana Liberato, Olga Kurylenko, Garrick Hagon, Eric Godon, Yassine Fadel, Neil Napier, David Bark-Jones, Alexander Fehling, Nick Alachiotis, Jade Hassouné","United States, Canada, Belgium, United Kingdom",4-Feb-18,2012,R,105 min,Action & Adventure
s5634,Movie,Sinister 2,Ciarán Foy,"Shannyn Sossamon, John Beasley, James Ransone, Tate Ellington, Robert Daniel Sloan, Dartanian Sloan, Lucas Jade Zumann, Lea Coco","United States, United Kingdom",16-Oct-19,2015,R,97 min,Horror Movies
s5376,Movie,Sandy Wexler,Steven Brill,"Adam Sandler, Jennifer Hudson, Kevin James, Terry Crews, Rob Schneider, Colin Quinn, Nick Swardson, Lamorne Morris, Arsenio Hall, Jamie Gray Hyder",United States,14-Apr-17,2017,TV-14,131 min,Comedies
s5206,Movie,Riding Faith,Paco Aguilar,"John Schneider, T.C. Stallings, Grace Van Dien, Marisa Brown, Jimmy Deshler",United States,17-Jun-20,2020,TV-PG,81 min,"Children & Family Movies, Dramas, Faith & Spirituality"
s2164,Movie,Final Destination,James Wong,"Devon Sawa, Ali Larter, Kerr Smith, Kristen Cloke, Seann William Scott, Tony Todd, Daniel Roebuck, Chad Donella, Roger Guenveur Smith, Amanda Detmer",United States,1-Jan-20,2000,R,98 min,"Cult Movies, Horror Movies, Thrillers"
s4380,Movie,Naa Bangaaru Talli,Rajesh Touchriver,"Siddique, Anjali Patil, Lakshmi Menon, Nina Kurup, Rathna Shekar Reddy, Anoop Aravindan",India,19-Oct-18,2013,TV-14,122 min,"Dramas, International Movies"
s6454,TV Show,The Hockey Girls,"Kiko Cruz Claverol, Patricia Font","Iria del Río, Nora Navas, Josep Linuesa, Natàlia Barrientos, Dèlia Brufau, Yasmina Drissi Sales, Júlia Gibert, Mireia Oriol, Asia Ortega Leiva, Claudia Riera, Mireia Aixalà, Juli Fàbregas, Àgata Roca, Marc Clotet",Spain,20-Sep-19,2019,TV-MA,1 Season,"International TV Shows, TV Comedies, TV Dramas"
s6575,Movie,The Late Bloomer,Kevin Pollak,"Johnny Simmons, Maria Bello, Brittany Snow, Kumail Nanjiani, Beck Bennett, Paul Wesley, Jane Lynch, J.K. Simmons, Lenora Crichlow",United States,6-Nov-20,2016,R,95 min,Comedies
s1220,Movie,Carlos Ballarta: El amor es de putos,"Jan Suter, Raúl Campos Delgado",Carlos Ballarta,Mexico,21-Nov-16,2016,TV-MA,67 min,Stand-Up Comedy
s5678,Movie,Smoke & Mirrors,Alberto Rodríguez,"Eduard Fernández, José Coronado, Marta Etura, Carlos Santos, Enric Benavent, Philippe Rebbot, Israel Elejalde, Tomás del Estal, Emilio Gutiérrez Caba",Spain,1-Jun-17,2016,TV-14,123 min,"Dramas, International Movies, Thrillers"
s2962,Movie,In Darkness,Anthony Byrne,"Natalie Dormer, Ed Skrein, Emily Ratajkowski, Neil Maskell, Jan Bijvoet, James Cosmo, Joely Richardson","United Kingdom, United States",22-Sep-18,2018,TV-MA,101 min,"Independent Movies, International Movies, Thrillers"
s6607,Movie,The Lives of Others,Florian Henckel von Donnersmarck,"Ulrich Mühe, Martina Gedeck, Sebastian Koch, Ulrich Tukur, Thomas Thieme, Hans-Uwe Bauer, Volkmar Kleinert, Matthias Brenner, Charly Hübner",Germany,15-Mar-19,2006,R,138 min,"Dramas, International Movies, Thrillers"
s4683,Movie,Organize Isler,Yılmaz Erdoğan,"Yılmaz Erdoğan, Tolga Çevik, Demet Akbağ, Altan Erkekli, Özgü Namal, Erdal Tosun, Tuncer Salman, Öner Erkan, Ebru Akel, Başak Köklükaya, Cem Yılmaz",Turkey,28-Apr-20,2005,TV-14,104 min,"Action & Adventure, Comedies, International Movies"
s5776,Movie,Spy Kids 3: Game Over,Robert Rodriguez,"Daryl Sabara, Sylvester Stallone, Ricardo Montalban, Alexa PenaVega",United States,1-Apr-19,2003,PG,83 min,"Children & Family Movies, Comedies"
s4189,Movie,Monster High: Escape from Skull Shores,"Steve Ball, Andrew Duncan","Kate Higgins, Debi Derryberry, Salli Saffioti, Evan Smith, Laura Bailey, Audu Paden, Erin Fitzgerald, Cindy Robinson, Ogie Banks, Cam Clarke",United States,1-Jan-18,2012,TV-Y7,46 min,Children & Family Movies
s6957,Movie,The Ugly Truth,Robert Luketic,"Katherine Heigl, Gerard Butler, Eric Winter, John Michael Higgins, Bree Turner, Nick Searcy, Kevin Connolly, Cheryl Hines, Bonnie Somerville, Yvette Nicole Brown, Nate Corddry, Noah Matthews",United States,25-Apr-19,2009,R,96 min,"Comedies, Romantic Movies"
s2233,Movie,Forbidden Games: The Justin Fashanu Story,"Jon Carey, Adam Darke","Justin Fashanu, John Fashanu",United Kingdom,1-Dec-17,2017,TV-14,81 min,"Documentaries, International Movies, LGBTQ Movies"
s7105,Movie,Tinker',Sonny Marler,"Clayne Crawford, Christian Kane, Colt Crawford, Wilmer Calderon, Randy Smith, Wendy Baron, Lennie Crawford, Chalet Lizette Brannan",United States,19-Mar-19,2018,TV-14,97 min,"Dramas, Independent Movies, Sci-Fi & Fantasy"
s3467,Movie,Kung Fu Panda: Holiday,Tim Johnson,"Jack Black, Angelina Jolie, Dustin Hoffman, Jackie Chan, Seth Rogen, Lucy Liu, David Cross, James Hong, Dan Fogler",United States,1-Dec-12,2010,TV-PG,26 min,"Children & Family Movies, Comedies"
s1650,Movie,De Palma,"Noah Baumbach, Jake Paltrow",Brian De Palma,United States,21-Nov-18,2015,R,110 min,Documentaries
