show_id,type,title,director,cast,country,date_added,release_year,rating,duration,listed_in
s5181,Movie,Revenge of the Green Dragons,"Andrew Lau Wai-Keung, Andrew Loo","Ray Liotta, Justin Chon, Kevin Wu, Harry Shum Jr., Eugenia Yuan, Leonard Wu, Jin Auyeung, Jon Kit Lee, Shuya Chang, Geoff Pierson","Hong Kong, United States",21-Jul-18,2014,R,95 min,"Action & Adventure, Dramas, Independent Movies"
s3272,Movie,Kaagar,Makarand Mane,"Rinku Rajguru, Shubhankar Tawde, Shashank Shende, Suhas Palshikar, Bharati Patil, Milind Pathak, Umesh Jagtap, Shantanu Gangane, Vitthal Kale, Mahesh Bhosale",India,10-Sep-20,2019,TV-MA,130 min,"Dramas, International Movies, Romantic Movies"
s3302,Movie,Kannum Kannum Kollaiyadithaal,Desingh Periyasamy,"Dulquer Salmaan, Ritu Varma, Rakshan, Niranjani, Gautham Menon, Anish Kuruvilla",India,29-Mar-20,2020,TV-14,160 min,"Comedies, Dramas, International Movies"
s2698,TV Show,Hemlock Grove,Eli Roth,"Famke Janssen, Landon Liboiron, Dougray Scott, Bill Skarsgård, Joel de la Fuente, Kaniehtiio Horn, Madeleine Martin, Michael Andreae, Penelope Mitchell, Freya Tingley, Laurie Fortier, Nicole Boivin, Ted Dykstra, Lili Taylor, Aaron Douglas, Kandyse McClure, Marty Adams, Demore Barnes, Madeline Brewer",United States,23-Oct-15,2015,TV-MA,3 Seasons,"TV Horror, TV Mysteries, TV Thrillers"
s1064,Movie,Bottom of the World,Richard Sears,"Jena Malone, Douglas Smith, Ted Levine, Tamara Duarte, Kelly Pendygraft, Mark Sivertsen, Jon McLaren","Canada, United States",28-May-20,2017,TV-MA,84 min,"Dramas, Independent Movies, Thrillers"
s7045,Movie,Thiago Ventura: POKAS,"Fabio Ock, Joana Mazzucchelli",Thiago Ventura,Brazil,2-Jul-20,2020,TV-MA,82 min,Stand-Up Comedy
s891,Movie,Bheeshma,Venky Kudumula,"Nitin Reddy, Rashmika Mandanna, Sampath Raj, Jishu Sengupta, Anant Nag",India,25-Apr-20,2020,TV-14,138 min,"Action & Adventure, Comedies, International Movies"
s3067,Movie,Ishqiya,Abhishek Chaubey,"Naseeruddin Shah, Vidya Balan, Arshad Warsi, Salman Shahid, Anupama Kumar",India,28-Sep-20,2009,TV-14,115 min,"Comedies, International Movies, Romantic Movies"
s3924,Movie,Maps to the Stars,David Cronenberg,"Julianne Moore, Mia Wasikowska, Robert Pattinson, John Cusack, Olivia Williams, Sarah Gadon, Evan Bird, Niamh Wilson, Dawn Greenhalgh","Canada, Germany, France, United States",16-Dec-18,2014,R,112 min,"Comedies, Dramas"
s2349,Movie,Gang of the Caribbean,Jean-Claude Flamand-Barny,"Djédjé Apali, Eriq Ebouaney, Adama Niane, Vincent Vermignon, Djibril Pavadé, Zita Hanrot, Karim Belkhadra, Lise Lomi, Zoé Charron, Jocelyne Béroard, Julien Courbey, Lucien Jean-Baptiste, Romane Bohringer, Mathieu Kassovitz",France,31-Jan-20,2016,TV-MA,86 min,"Dramas, International Movies"
s117,Movie,4th Republic,Ishaya Bako,"Kate Henshaw-Nuttal, Enyinna Nwigwe, Linda Ejiofor, Yakubu Mohammed, Bimbo Manuel, Sani Mu’azu, Emil Hirai-Garuba, Rekiya Ibrahim Atta",Nigeria,13-Jun-20,2019,TV-MA,120 min,"Dramas, International Movies, Thrillers"
s729,Movie,Barça Dreams,Jordi Llompart,"Johan Cruyff, Andrés Iniesta, Gary Lineker, Xavi Hernández, Lionel Messi, Pau Gasol",Spain,1-Sep-18,2015,TV-MA,122 min,"Documentaries, International Movies, Sports Movies"
s3562,Movie,LeapFrog: Phonics Farm,Ron Myrick,"Jeannie Elias, Kat Feller, Sandy Fox, Cindy Robinson, Richard Rosenblatt",United States,15-Apr-20,2011,TV-Y,35 min,Movies
s2689,Movie,Hell and Back,"Tom Gianas, Ross R. Shuman","Nick Swardson, Mila Kunis, Bob Odenkirk, T.J. Miller, Rob Riggle, Susan Sarandon, Danny McBride, Jennifer Coolidge, John Farley, Maria Bamford",United States,6-Sep-18,2015,R,86 min,"Action & Adventure, Comedies, Independent Movies"
s1371,Movie,Christmas with a Prince,Justin G. Dyck,"Kaitlyn Leeb, Nick Hounslow, Josh Dean, Melinda Shankar, Liam MacDonald, Ilamaria Ebrahim, Charles Shaughnessy, Julia Baldwin",Canada,4-Nov-20,2018,TV-PG,86 min,"Comedies, Dramas, Romantic Movies"
s1428,Movie,Cloudy with a Chance of Meatballs 2,"Cody Cameron, Kris Pearn","Bill Hader, Anna Faris, James Caan, Will Forte, Andy Samberg, Benjamin Bratt, Neil Patrick Harris, Terry Crews, Kristen Schaal",United States,15-Nov-20,2013,PG,95 min,"Children & Family Movies, Comedies"
s6806,Movie,The Real Miyagi,Kevin Derek,Fumio Demura,"United States, Canada, Japan, Panama",16-Jun-17,2015,TV-PG,81 min,"Documentaries, Sports Movies"
s810,Movie,Before the Summer Crowds,Mohamed Khan,"Maged El Kedwany, Hana Shiha, Ahmed Dawood, Lana Mushtak, Hany El Metennawy",Egypt,5-Jun-20,2016,TV-14,86 min,"Dramas, International Movies"
s1404,Movie,City of Tiny Lights,Pete Travis,"Riz Ahmed, Billie Piper, James Floyd, Cush Jumbo, Roshan Seth, Hannah Rae, Antonio Aakeel, George Sargeant, Alexander Siddig, Vincent Regan, Barry Aird",United Kingdom,21-Jul-17,2016,TV-MA,110 min,"Dramas, International Movies, Thrillers"
s3920,Movie,Mantostaan,Rahat Kazmi,"Raghuvir Yadav, Veerendra Saxena, Sonal Sehgal, Aaditya Pratap Singh, Rahat Kazmi, Raina Bassnet, Sakshi Bhat",India,15-Dec-17,2017,TV-MA,75 min,"Dramas, Independent Movies, International Movies"
s7423,Movie,Vincent N Roxxy,Gary Michael Schultz,"Emile Hirsch, Zoë Kravitz, Emory Cohen, Zoey Deutch, Beau Knapp, Jason Mitchell, Scott Mescudi, Jeff Gum, Joey Bicicchi",United States,2-Sep-17,2016,R,101 min,"Dramas, Thrillers"
s239,Movie,A Thin Line Between Love & Hate,Martin Lawrence,"Martin Lawrence, Lynn Whitfield, Regina King, Bobby Brown, Della Reese, Daryl Mitchell, Roger Mosley, Malinda Williams, Roger E. Mosley, Simbi Khali, Tangie Ambrose, Wendy Raquel Robinson, Stacii Jae Johnson, Faizon Love, Miguel A. Núñez Jr., Tracy Morgan",United States,1-Dec-20,1996,R,108 min,"Comedies, Romantic Movies"
s5085,Movie,Ralph Breaks the Internet: Wreck-It Ralph 2,"Phil Johnston, Rich Moore","John C. Reilly, Sarah Silverman, Taraji P. Henson, Gal Gadot, Jack McBrayer, Jane Lynch, Alan Tudyk, Ed O'Neill, Susan Lucci, Jason Lee, Idina Menzel, Anika Noni Rose, Judy Reyes, Grant Show, Ana Ortiz, Ming-Na Wen, Rebecca Wisocky, Paige O'Hara, Linda Larkin, Mariana Klaveno, Daria Ramirez, Tom Irwin, Edy Ganem, Irene Bedard, Jodi Benson, Anthony Daniels",United States,11-Jun-19,2018,PG,113 min,"Children & Family Movies, Comedies"
s6281,Movie,The Death of Stalin,Armando Iannucci,"Steve Buscemi, Simon Russell Beale, Paddy Considine, Rupert Friend, Jason Isaacs, Michael Palin, Andrea Riseborough, Jeffrey Tambor, Olga Kurylenko, Paul Chahidi","United Kingdom, France, Belgium, Canada, United States",3-Apr-20,2017,R,107 min,"Comedies, Dramas, Independent Movies"
s3081,Movie,It's Now or Never,Maria Ripoll,"Dani Rovira, María Valverde, Jordi Sánchez, Joaquín Núñez, Alicia Rubio, Clara Lago, Anna Gras, Gracia Olayo, Melody, Marta Pérez",Spain,1-Mar-16,2015,TV-MA,91 min,"Comedies, International Movies, Romantic Movies"
s6524,Movie,The Karate Kid,Harald Zwart,"Jaden Smith, Jackie Chan, Taraji P. Henson, Wenwen Han, Yu Rongguang, Zhensu Wu, Zhiheng Wang, Zhenwei Wang, Shijia Lü, Yi Zhao","United States, China",17-Oct-19,2010,PG,140 min,"Children & Family Movies, Dramas"
s2667,Movie,He Named Me Malala,Davis Guggenheim,Malala Yousafzai,"United States, United Arab Emirates",1-Jun-18,2015,PG-13,89 min,Documentaries
s1833,Movie,Double Dad,Cris D'Amato,"Maisa Silva, Eduardo Moscovis, Marcelo Médici, Laila Zaid, Pedro Ottoni, Rayana Diniz, Caio Vegatti, Fafá de Belém, Thaynara Og, Roberto Bonfim",Brazil,15-Jan-21,2020,TV-G,105 min,"Children & Family Movies, Comedies, Dramas"
s2071,Movie,Extinction,Ben Young,"Michael Peña, Lizzy Caplan, Israel Broussard, Mike Colter, Emma Booth, Lex Shrapnel, Erica Tremblay, Lilly Aspell",United States,27-Jul-18,2018,TV-MA,95 min,"Action & Adventure, Dramas, Sci-Fi & Fantasy"
s2767,Movie,Hokkabaz,"Ali Taner Baltacı, Cem Yılmaz","Cem Yılmaz, Mazhar Alanson, Özlem Tekin, Tuna Orhan, Tuncer Salman, Kemal İnci, Gürgen Öz, Caner Alkaya, Ayçe Abana, Bahtiyar Engin",Turkey,10-Mar-17,2006,TV-MA,118 min,"Comedies, Dramas, International Movies"
s4519,Movie,Nothing to Lose,Alexandre Avancini,"Petrônio Gontijo, Day Mesquita, Beth Goulart, Dalton Vigh, Eduardo Galvão, André Gonçalves, Marcello Airoldi",Brazil,20-Jul-18,2018,PG,133 min,"Dramas, Faith & Spirituality, International Movies"
s3131,Movie,Jay and Silent Bob Strike Back,Kevin Smith,"Jason Mewes, Kevin Smith, Ben Affleck, Jeff Anderson, Brian O'Halloran, Shannon Elizabeth, Eliza Dushku, Ali Larter, Jennifer Schwalbach, Will Ferrell, Jason Lee",United States,1-Jan-19,2001,R,105 min,"Comedies, Cult Movies"
s5048,Movie,Raajneeti,Prakash Jha,"Ajay Devgn, Nana Patekar, Ranbir Kapoor, Katrina Kaif, Arjun Rampal, Manoj Bajpayee, Sarah Thompson, Naseeruddin Shah",India,2-Aug-18,2010,TV-14,162 min,"Dramas, International Movies, Thrillers"
s7152,Movie,Tootsies & The Fake,Kittiphak Thonguam,"Araya A. Hargate, Paopetch Charoensook, Thongkanthom Thongchai, Ratthanant Janyajirawong, Pattarasaya Kreuasuwansri, Gunn Svasti Na Ayudhya, Kritsanapoom Pibulsonggram, Keetapat Pongruea",Thailand,5-Mar-20,2019,TV-MA,108 min,"Comedies, International Movies, LGBTQ Movies"
s2116,Movie,Farce,Shadi Ali,"Ahmed Fathy, Bayoumi Fouad, Sami Maghouri, Mohammed Tharwat, Mohamed Salam, Haya Ibrahim, Mohsen Mansour",Egypt,6-Jun-19,2017,TV-MA,94 min,"Comedies, International Movies"
s4067,Movie,Michael,Ribhu Dasgupta,"Naseeruddin Shah, Mahie Gill, Sabyasachi Chakraborty, Rudranil Ghosh, Iravati Harshe, Churni Ganguly, June Maliah, Purav Bhandare, Shridhar Watsar",India,5-Jul-20,2011,TV-MA,86 min,"Dramas, Independent Movies, International Movies"
s1917,Movie,Echo in the Canyon,Andrew Slater,"Jakob Dylan, Ringo Starr, Michelle Phillips, Stephen Stills, Regina Spektor, Beck, Eric Clapton, Tom Petty, Jackson Browne, Norah Jones",United States,24-Oct-19,2019,PG-13,82 min,"Documentaries, Music & Musicals"
s4036,Movie,Menashe,"Josh Z. Weinstein, Joshua Z. Weinstein","Menashe Lustig, Ruben Niborski, Yoel Weisshaus, Meyer Schwartz, Yoel Falkowitz, Ariel Vaysman",United States,25-Jan-20,2017,PG,82 min,"Dramas, Independent Movies"
s3762,Movie,Love Is War,Omoni Oboli,"Omoni Oboli, Richard Mofe-Damijo, Jide Kosoko, Akin Lewis, Bimbo Manuel, Shaffy Bello, Toke Makinwa, Femi Branch, Uzor Osimkpa",Nigeria,29-Apr-20,2019,TV-14,111 min,"Comedies, Dramas, International Movies"
s2421,Movie,Girl,Lukas Dhont,"Victor Polster, Arieh Worthalter, Oliver Bodart, Tijmen Govaerts, Katelijne Damen, Valentijn Dhaenens, Magali Elali, Alice de Broqueville, Chris Thys, Angelo Tijssens","Netherlands, Belgium",15-Mar-19,2018,R,106 min,"Dramas, International Movies, LGBTQ Movies"
s6433,Movie,The Happytime Murders,Brian Henson,"Melissa McCarthy, Elizabeth Banks, Maya Rudolph, Bill Barretta, Leslie David Baker, Joel McHale, Dorien Davies, Cynthy Wu, Michael McDonald, Mitch Silpa","United States, China, Canada",1-Dec-20,2018,R,91 min,"Action & Adventure, Comedies"
s5291,Movie,Roxanne Roxanne,Michael Larnell,"Chanté Adams, Mahershala Ali, Nia Long, Elvis Nolasco, Kevin Phillips, Shenell Edmonds",United States,23-Mar-18,2018,TV-MA,100 min,Dramas
s6498,Movie,The Intent 2: The Come Up,"Femi Oyeniran, Nicky Slimting Walker","Justin Clarke Samuel, Ashley Chin, Nicky Slimting Walker, Femi Oyeniran, Dylan Duffus, Shone Romulus, Adam Deacon, Karen Bryson, Selva Rasalingam, Jay Brown",United Kingdom,21-Feb-19,2018,TV-MA,103 min,"Dramas, International Movies"
s4052,Movie,Mersal,Atlee Kumar,"Joseph Vijay, S.J. Surya, Kajal Aggarwal, Samantha Ruth Prabhu, Nithya Menon, Vadivelu, Sathyaraj",India,21-Aug-18,2017,TV-14,162 min,"Action & Adventure, Dramas, International Movies"
s6471,Movie,The Humanity Bureau,Rob W. King,"Nicolas Cage, Sarah Lind, Hugh Dillon, Jakob Davies, Vicellous Shannon, Kurt Max Runte, Lorne Cardinal, Jett Klyne, David Lovgren",Canada,18-Dec-18,2017,R,94 min,"Action & Adventure, Sci-Fi & Fantasy"
s7781,Movie,Zoo,Shlok Sharma,"Shashank Arora, Shweta Tripathi, Rahul Kumar, Gopal K. Singh, Yogesh Kurme, Prince Daniel",India,1-Jul-18,2018,TV-MA,94 min,"Dramas, Independent Movies, International Movies"
s4009,Movie,Mean Streets,Martin Scorsese,"Robert De Niro, Harvey Keitel, David Proval, Amy Robinson, Richard Romanus, Cesare Danova, Victor Argo, George Memmoli",United States,1-Jul-19,1973,R,112 min,"Classic Movies, Dramas, Independent Movies"
s578,Movie,Ari Eldjárn: Pardon My Icelandic,August Jakobsson,Ari Eldjárn,Iceland,2-Dec-20,2020,TV-MA,54 min,Stand-Up Comedy
s55,Movie,100 Meters,Marcel Barrena,"Dani Rovira, Karra Elejalde, Alexandra Jiménez, David Verdaguer, Clara Segura, Alba Ribas, Bruno Bergonzini, Ricardo Pereira, Manuela Couto, Marc Balaguer","Portugal, Spain",10-Mar-17,2016,TV-MA,109 min,"Dramas, International Movies, Sports Movies"
s7081,Movie,Tig,"Kristina Goolsby, Ashley York",Tig Notaro,United States,17-Jul-15,2015,TV-14,92 min,"Documentaries, Stand-Up Comedy"
s3051,Movie,Ip Man 4: The Finale,Wilson Yip,"Donnie Yen, Wu Yue, Vanness Wu, Scott Adkins, Kent Cheng, Danny Chan Kwok-kwan, Kanin Ngo, Chris Collins, Vanda Margraf, Meng Lo","Hong Kong, China",21-Jul-20,2019,TV-MA,105 min,"Action & Adventure, Dramas, International Movies"
s6338,Movie,The Evil Dead,Sam Raimi,"Bruce Campbell, Ellen Sandweiss, Richard DeManincor, Betsy Baker, Theresa Tilly, Bill Vincent, Scott Spiegel, Ivan Raimi, David Horton, John Cameron, Ted Raimi",United States,10-Jan-20,1981,TV-MA,85 min,"Classic Movies, Cult Movies, Horror Movies"
s6996,Movie,The Week Of,Robert Smigel,"Adam Sandler, Chris Rock, Steve Buscemi, Rachel Dratch, Allison Strong, Roland Buck III, Katie Hartman, Chloe Himmelman, Jake Lippmann, Jim Barone, June Gable",United States,27-Apr-18,2018,TV-14,117 min,Comedies
s3035,Movie,Into the Wild,Sean Penn,"Emile Hirsch, Marcia Gay Harden, William Hurt, Jena Malone, Brian Dierker, Catherine Keener, Vince Vaughn, Kristen Stewart, Hal Holbrook, Zach Galifianakis",United States,1-Jan-21,2007,R,148 min,"Action & Adventure, Dramas, Independent Movies"
s6930,Movie,The Tigers of Scotland,Leanne Gater,Iain Glen,United Kingdom,1-Nov-18,2017,TV-G,58 min,Documentaries
s2401,Movie,Ghost Stories,"Anurag Kashyap, Dibakar Banerjee, Karan Johar, Zoya Akhtar","Janhvi Kapoor, Sobhita Dhulipala, Sukant Goel, Gulshan Devaiah, Mrunal Thakur, Avinash Tiwary, Vijay Varma, Sagar Arya, Surekha Sikri, Pavail Gulati",India,1-Jan-20,2020,TV-MA,145 min,"Horror Movies, International Movies, Thrillers"
s3391,Movie,Killers,Robert Luketic,"Katherine Heigl, Ashton Kutcher, Tom Selleck, Catherine O'Hara, Katheryn Winnick, Kevin Sussman, Lisa Ann Walter, Casey Wilson, Rob Riggle, Martin Mull, Alex Borstein",United States,1-Jan-21,2010,PG-13,100 min,"Action & Adventure, Comedies, Romantic Movies"
s3095,Movie,Jab Harry Met Sejal,Imtiaz Ali,"Shah Rukh Khan, Anushka Sharma, Aru Krishansh Verma, Chandan Roy Sanyal, Evelyn Sharma, Kavi Shastri, Barbora Mudrochova, Paula Donner, Denis Dorokhov, Martavious Gayles",India,2-Dec-17,2017,TV-MA,142 min,"Comedies, International Movies, Romantic Movies"
s1720,Movie,Destiny,Youssef Chahine,"Nour El-Sherif, Laila Elwi, Mahmoud Hemeida, Safia el-Emari, Mohamed Mounir, Khaled El Nabawy, Seif Abdelrahman, Abdalla Mahmoud, Ahmed Fouad Selim, Magdi Idris","France, Egypt",19-Jun-20,1997,TV-14,136 min,"Dramas, International Movies"
s2970,Movie,In Search of Fellini,Taron Lexton,"Ksenia Solo, Mary Lynn Rajskub, Maria Bello, Enrico Oetiker, Paolo Bernardini, Beth Riesgraf, David O'Donnell, Nancy Cartwright, Bruno Zanin, Michael Wiseman, Andrea Osvárt",United States,19-Mar-18,2017,R,103 min,"Action & Adventure, Dramas"
s7526,Movie,Welcome Mr. President,Riccardo Milani,"Claudio Bisio, Kasia Smutniak, Beppe Fiorello, Remo Girone, Massimo Popolizio, Cesare Bocci, Omero Antonutti, Michele Alhaique, Franco Ravera, Patrizio Rispo, Piera Degli Esposti, Gianni Cavina",Italy,1-Oct-16,2013,TV-MA,99 min,"Comedies, International Movies"
s728,Movie,Bangkok Traffic (Love) Story,Adisorn Tresirikasem,"Theeradej Wongpuapan, Sirin Horwang, Ungsumalynn Sirapatsakmetha, Panissara Phimpru, Taksaorn Paksukcharern, Charlie Trairat, Kazuki Yano",Thailand,5-Sep-18,2009,TV-14,126 min,"Comedies, International Movies, Romantic Movies"
s3705,Movie,Logan's Run,Michael Anderson,"Michael York, Richard Jordan, Farrah Fawcett, Jenny Agutter, Peter Ustinov, Roscoe Lee Browne, Randolph Roberts, Gary Morgan, Greg Lewis",United States,1-Nov-19,1976,PG,118 min,"Action & Adventure, Classic Movies, Cult Movies"
s473,Movie,American Pie 9: Girls' Rules,Mike Elliott,"Madison Pettis, Lizze Broadway, Piper Curda, Natasha Behnam, Darren Barnet, Sara Rue, Zachary Gordon, Camaron Engels, Christian Valderrama, Zayne Emory",United States,6-Oct-20,2020,R,96 min,Comedies
s7415,Movie,Victim of Beauty,Roger Young,"William Devane, Jeri Ryan, Michele Abrams, Nick Searcy, Linda Pierce, J. Don Ferguson, Butch Slade, Joyce Bowden-Kirby",United States,1-Oct-11,1991,TV-14,93 min,"Dramas, Thrillers"
s223,Movie,A Second Chance,Cathy Garcia-Molina,"John Lloyd Cruz, Bea Alonzo, Dimples Romana, Janus del Prado, James Blanco, Ahron Villena, Beatriz Saw, Shamaine Centenera, Khalil Ramos, Billy Crawford, Al Tantay, Arci Muñoz",Philippines,27-Feb-19,2015,TV-MA,130 min,"Dramas, International Movies, Romantic Movies"
s393,Movie,Alice Doesn't Live Here Anymore,Martin Scorsese,"Ellen Burstyn, Kris Kristofferson, Billy Green Bush, Diane Ladd, Harvey Keitel, Lelia Goldoni, Lane Bradbury, Vic Tayback, Jodie Foster, Alfred Lutter",United States,1-Jul-19,1974,PG,112 min,"Classic Movies, Comedies, Dramas"
s7127,Movie,Todo lo que sería Lucas Lauriente,"Raúl Campos, Jan Suter",Lucas Lauriente,Argentina,6-Apr-18,2018,TV-MA,78 min,Stand-Up Comedy
s4866,Movie,Pinky Memsaab,Shazia Ali Khan,"Hajira Yamin, Kiran Malik, Adnan Jaffar, Sunny Hinduja, Khalid Ahmed, Shamim Hilaly, Hajrah Khan, Ahmed Ali Khan","Pakistan, United Arab Emirates",1-Apr-19,2018,TV-MA,124 min,"Dramas, Independent Movies, International Movies"
s7497,Movie,We Are Family,Sidharth Malhotra,"Kajol, Kareena Kapoor, Arjun Rampal, Nominath Ginsberg, Iravati Harshe, Aachal Munjal, Diya Sonecha","India, Australia",1-Oct-18,2010,TV-14,119 min,"Dramas, International Movies"
s3265,Movie,K-on! the movie,Naoko Yamada,"Aki Toyosaki, Yoko Hikasa, Satomi Sato, Minako Kotobuki, Ayana Taketatsu, Asami Sanada, Madoka Yonezawa, Chika Fujito, Yoriko Nagata",Japan,15-Nov-19,2011,TV-PG,110 min,"Anime Features, Music & Musicals"
s3805,Movie,Lucha: Playing the Impossible,Ana Quiroga,Luciana Aymar,Argentina,15-Jul-18,2016,TV-PG,98 min,"Documentaries, International Movies, Sports Movies"
s2725,Movie,High & Low The Movie 2 / End of Sky,"Shigeaki Kubo, Tsuyoshi Nakakuki","Takanori Iwata, Keiji Kuroki, Aoi Nakamura, Yuki Yamada, Masataka Kubota, Kento Hayashi, Naoto, Akira, Sho Aoyagi, Takahiro, Hiroomi Tosaka, Nobuyuki Suzuki, Keita Machida, Elly, Mandy Sekiguchi, Reo Sano, Masahiko Tsugawa",Japan,20-Sep-20,2017,TV-MA,124 min,"Action & Adventure, International Movies"
s2863,Movie,Humko Deewana Kar Gaye,Raj Kanwar,"Akshay Kumar, Katrina Kaif, Bipasha Basu, Bhagyashree, Shernaz Patel, Vivek Shaq, Mahesh Thakur, Ranjeet, Nina Kulkarni, Puneet Issar, Anju Mahendru, Manoj Joshi, Anil Kapoor",India,22-Oct-17,2006,TV-PG,149 min,"International Movies, Music & Musicals, Romantic Movies"
s3203,Movie,John Carter,Andrew Stanton,"Taylor Kitsch, Lynn Collins, Samantha Morton, Willem Dafoe, Thomas Haden Church, Mark Strong, Ciarán Hinds, Dominic West, James Purefoy, Bryan Cranston, Polly Walker, Daryl Sabara, Art Malik, Eileen Page, Amanda Clayton, Davood Ghadami, Daniel O'Meara, Jill Baker, Josh Daugherty, Oliver Boot, Philip Arditti, Arkie Reece, Joe Billingiere, Don Stark, Darwin Shaw, Figs Jackman, David Schwimmer, Emma Clifford, Christopher Goodman, Cate Fowler, Sean Carrigan, Dusty Sorg, Steven Cree, Phil Cheadle, Holly Weston, Nicholas Woodeson, Rupert Frazer, Edmund Kente",United States,2-May-19,2012,PG-13,133 min,"Action & Adventure, Sci-Fi & Fantasy"
s6770,Movie,The Polar Express,Robert Zemeckis,"Tom Hanks, Leslie Zemeckis, Eddie Deezen, Nona Gaye, Peter Scolari, Brendan King, Andy Pellick, Michael Jeter, Chris Coppola, Julene Renee",United States,1-Jan-21,2004,G,100 min,Children & Family Movies
s4787,Movie,Passenger 57,Kevin Hooks,"Wesley Snipes, Bruce Payne, Tom Sizemore, Alex Datcher, Bruce Greenwood, Elizabeth Hurley, Michael Horse, Marc Macaulay, Ernie Lively",United States,1-Jan-21,1992,R,84 min,Action & Adventure
s7450,Movie,W.E.,Madonna,"Abbie Cornish, Andrea Riseborough, James D'Arcy, Oscar Isaac, Richard Coyle, David Harbour, James Fox, Judy Parfitt, Haluk Bilginer, Geoffrey Palmer, Natalie Dormer",United Kingdom,3-Mar-20,2011,R,119 min,"Dramas, Romantic Movies"
s7268,Movie,Tune in for Love,Jung Ji-woo,"Kim Go-eun, Jung Hae-in, Park Hae-joon, Kim Guk-hee, Jung Eugene, Choi Jun-young, Yoo Yeol, Nam Mun-cheol",South Korea,5-Nov-19,2019,TV-MA,123 min,"Dramas, International Movies, Romantic Movies"
s3248,Movie,Just Another Christmas,Roberto Santucci,"Leandro Hassum, Elisa Pinheiro, Danielle Winits, Louise Cardoso, Rodrigo Fagundes, Arianne Botelho, Miguel Rômulo, José Rubens Chachá, Levi Ferreira, Daniel Filho",Brazil,3-Dec-20,2020,TV-MA,101 min,"Comedies, International Movies"
s2901,Movie,I Am Not Your Negro,Raoul Peck,"Samuel L. Jackson, Joey Starr","Switzerland, France, Belgium, United States",3-Jul-20,2017,PG-13,94 min,Documentaries
s4665,Movie,Opening Night,Isaac Rentz,"Topher Grace, Alona Tal, Anne Heche, Taye Diggs, Rob Riggle, Paul Scheer, J.C. Chasez, Lauren Lapkus, Lesli Margherita, Brian Huskey",United States,1-Aug-17,2016,TV-MA,84 min,"Comedies, Independent Movies, Music & Musicals"
s1636,Movie,David Brent: Life on the Road,Ricky Gervais,"Ricky Gervais, Doc Brown, Tom Basden, Jo Hartley, Tom Bennett, Andrew Brooke, Nina Sosanya, Andy Burrows, Kevin Bishop, Roisin Conaty, Diane Morgan, Ashley McGuire, Alexander Arnold, Mandeep Dhillon","United Kingdom, United States",10-Feb-17,2016,TV-MA,97 min,"Comedies, International Movies"
s6435,Movie,The Hateful Eight,Quentin Tarantino,"Samuel L. Jackson, Kurt Russell, Jennifer Jason Leigh, Walton Goggins, Demián Bichir, Tim Roth, Michael Madsen, Bruce Dern, James Parks, Dana Gourrier, Channing Tatum, Zoë Bell",United States,25-Oct-17,2015,R,168 min,"Action & Adventure, Thrillers"
s6878,Movie,The Skin of the Wolf,Samu Fuentes,"Mario Casas, Irene Escolar, Ruth Díaz",Spain,6-Jul-18,2018,TV-MA,110 min,"Dramas, Independent Movies, International Movies"
s6407,Movie,"The Goods: Live Hard, Sell Hard",Neal Brennan,"Jeremy Piven, Ving Rhames, James Brolin, David Koechner, Kathryn Hahn, Ed Helms, Jordana Spiro, Tony Hale, Ken Jeong, Rob Riggle, Kristen Schaal, Alan Thicke, Jonathan Sadowski, Joey Kern, Craig Robinson",United States,20-Nov-19,2009,R,89 min,Comedies
s5235,Movie,Roberto Saviano: Writing Under Police Protection,Pierfrancesco Diliberto,Pierfrancesco Diliberto,Italy,1-May-18,2016,TV-14,45 min,"Documentaries, International Movies"
s940,Movie,Bitcoin Heist,Ham Tran,"Kate Nhung, Thanh Pham, Petey Majik Nguyen, Suboi, Jayvee Mai The Hiep, Lam Thanh My",Vietnam,2-Sep-17,2016,TV-14,116 min,"Action & Adventure, Comedies, International Movies"
s2730,Movie,High Flying Bird,Steven Soderbergh,"André Holland, Zazie Beetz, Bill Duke, Kyle MacLachlan, Melvin Gregg, Sonja Sohn, Zachary Quinto",United States,8-Feb-19,2019,TV-MA,91 min,"Dramas, Sports Movies"
s3967,Movie,Marvel's Iron Man & Hulk: Heroes United,"Leo Riley, Eric Radomski","Adrian Pasdar, Fred Tatasciore, Dee Bradley Baker, Robin Atkin Downes, David Kaye",United States,16-Feb-14,2013,PG,72 min,"Action & Adventure, Sci-Fi & Fantasy"
s6183,Movie,The Bros,You-Jeong Chang,"Dong-hwi Lee, Dong-seok Ma, Ha-Nui Lee, Woo-jin Jo, Young-chang Song, Chang-wook Ji, Man-seok Oh, Ye-ji Seo",South Korea,2-Feb-18,2017,TV-14,102 min,"Comedies, Dramas, International Movies"
s4448,Movie,Neseli Hayat,Yılmaz Erdoğan,"Yılmaz Erdoğan, Ersin Korkut, Büşra Pekin, Erdal Tosun, Rıza Akın, Sinan Bengier, Cezmi Baskın, Ayberk Atilla, Fatma Murat, Metin Yıldız",Turkey,28-Apr-20,2009,TV-14,108 min,"Comedies, International Movies"
s6179,Movie,The Breakup Playlist,Dan Villegas,"Piolo Pascual, Sarah Geronimo, Rio Locsin, Dennis Padilla, Badjie Mortiz, Teddy Corpuz, Anna Luna, Jett Pangan, Cris Villonco, Maris Racal",Philippines,27-Feb-19,2015,TV-MA,118 min,"Dramas, International Movies, Music & Musicals"
s688,Movie,Bad Boys,Michael Bay,"Will Smith, Martin Lawrence, Téa Leoni, Tchéky Karyo, Theresa Randle, Joe Pantoliano, Emmanuel Xuereb, Michael Imperioli, Nestor Serrano, Julio Oscar Mechoso",United States,1-Oct-19,1995,R,119 min,"Action & Adventure, Comedies"
s6621,Movie,The Lost Okoroshi,Abba T. Makama,"Seun Ajayi, Judith Audu, Tope Tedela, Ifu Ennada, Chiwetalu Agu, Demi Banwo, Ibrahim Jammal, Micheal Ajotubu, Ozzy Agu, Cristabel Goddy",Nigeria,4-Sep-20,2019,TV-MA,94 min,"Comedies, Dramas, Independent Movies"
s7408,Movie,Verses of Love,Hanung Bramantyo,"Fedi Nuril, Rianti Cartwright, Carissa Putri, Melanie Putria, Zaskia Adya Mecca, Surya Saputra, Dennis Adhiswara, Oka Antara",Indonesia,27-Mar-19,2008,TV-PG,126 min,"Dramas, International Movies, Romantic Movies"
s6133,Movie,The Binding,Domenico de Feudis,"Riccardo Scamarcio, Mía Maestro",Italy,2-Oct-20,2020,TV-MA,93 min,"Horror Movies, International Movies, Thrillers"
s654,Movie,B.A. Pass 2,Shadab Khan,"Kritika Sachdeva, Sasho, Sanghmitra Hitaishi, Indraneil Sengupta, Saurabh Dubey, Shubhangi Latkar, Sukhbir Kaur Lamba, Arav Chowdharry",India,1-Jun-18,2017,TV-14,126 min,"Dramas, International Movies"
s5660,Movie,Slam,Andrea Molaioli,"Ludovico Tersigni, Jasmine Trinca, Luca Marinelli, Barbara Ramella, Gianluca Broccatelli, Pietro Ragusa, Fiorenza Tessari",Italy,15-Apr-17,2017,TV-MA,99 min,"Comedies, Dramas, International Movies"
s2743,Movie,Hillbilly Elegy,Ron Howard,"Amy Adams, Glenn Close, Gabriel Basso, Haley Bennett, Freida Pinto, Bo Hopkins, Owen Asztalos",United States,24-Nov-20,2020,R,117 min,Dramas
